4 UCR graduate students win grants to do research in the natural reserves,"Projects include the study of aquatic insect communities, bumble bees, and the impact of climate change on plants",https://news.ucr.edu/articles/2018/12/10/4-ucr-graduate-students-win-grants-do-research-natural-reserves
Effective messaging for crowdfunding campaigns,Research shows which types of updates and comments keep donations flowing,https://news.ucr.edu/articles/2021/06/24/effective-messaging-crowdfunding-campaigns
‘Closure’ for 2020 and 2021 graduates,"Nearly 4,500 students participated in modified in-person commencement ceremonies.",https://news.ucr.edu/articles/2021/06/16/closure-2020-and-2021-graduates
2021 voices: Grads share pivotal moments of their educational journeys,"More than 7,100 students are eligible to graduate; Commencement events kick off on June 3 with the School of Medicine.",https://news.ucr.edu/articles/2021/06/01/2021-voices-grads-share-pivotal-moments-their-educational-journeys
UC Riverside receives $4.5 million for engineering graduate education,Five GAANN Awards from the U.S. Department of Education will support 90 engineering graduate students,https://news.ucr.edu/articles/2018/12/10/uc-riverside-receives-45-million-engineering-graduate-education
"Joan Didion's 'lost' commencement address, revealed","California-rooted author and new journalism maven Joan Didion, who died Dec. 23, 2021, delivered a commencement address at UC Riverside in 1975. In subsequent decades, excerpts have frequently been quoted in major media, including in a New York Times review of her book “The Year of Magical Thinking” and again in a Times story on the day of her passing.",https://news.ucr.edu/articles/2022/01/10/joan-didions-lost-commencement-address-revealed
Trust the power of markets,"People trust decisions made by groups, but information markets are more accurate",https://news.ucr.edu/articles/2020/08/19/trust-power-markets
Highlander Pep Band surprises campus with hype song,"Imagine you’re sitting in class on a random Thursday morning, listening to your chemistry professor, and then a 15-piece band bursts in the room blasting the Macklemore and Ryan Lewis throwback hit, “Can’t Hold Us” — but the tuba, symbols, trumpet, and flute version. If you were on campus on May 18, you didn’t have to imagine it because it happened in real life — and the UC Riverside Highlander Pep Band filled random locations around campus with music while a camera crew filmed crowd reactions.",https://news.ucr.edu/articles/2022/06/01/highlander-pep-band-surprises-campus-hype-song
Good fence libraries make good neighbors,UCR author Susan Straight’s fence library continues to serve a Riverside community disproportionately affected by the coronavirus,https://news.ucr.edu/articles/2020/08/19/good-fence-libraries-make-good-neighbors
California’s worst wildfires are helping improve air quality prediction,New method measures and predicts air quality in areas with insufficient monitoring,https://news.ucr.edu/articles/2021/04/21/californias-worst-wildfires-are-helping-improve-air-quality-prediction
A drunk driver killed her parents. Now she’s graduating to honor them,"Azalea Corral has a family photo that shows her three younger siblings and parents smiling together against a Santa Barbara countryside backdrop. It was taken on February 8, 2020 — the last time they would pose together for a photo.  The following day, both her parents succumbed to bodily injuries after a drunk driver struck them while they were out on their usual evening stroll in Goleta, a community about 12 miles west of Santa Barbara. Corral’s siblings were in the house; she was on a train back to Riverside. ",https://news.ucr.edu/articles/2022/05/26/drunk-driver-killed-her-parents-now-shes-graduating-honor-them
Genetic background may affect adaptions to aging,UC Riverside-led study evaluated individual differences in DNA methylation across 10 years in two Scandinavian samples of same‐sex aging twins,https://news.ucr.edu/articles/2020/08/19/genetic-background-may-affect-adaptions-aging
Quickly optimizing deep neural networks for different devices,New technique makes apps perform better across devices while keeping costs about the same,https://news.ucr.edu/articles/2021/11/15/quickly-optimizing-deep-neural-networks-different-devices
Project Moving Forward: A benchmark for student success,"RIVERSIDE, Calif. - As a young teacher, Linda Navarrette traveled to South Africa with one assignment: help teachers develop critical thinking skills in their students. Little did she know that her efforts in those impoverished communities would change her life. The experience catapulted her career into education, cementing her support for students who are learning English as a second language.",https://news.ucr.edu/articles/2018/01/29/project-moving-forward-benchmark-student-success
What Makes Kids With Autism Less Social Than Their Typically Developing Peers?,"Pick a hand, any hand. That familiar refrain, repeated in schoolyards the world over, is the basis of a simple guessing game that was recently adapted to study how and why kids with autism spectrum disorder (ASD) interact with the people around them.",https://news.ucr.edu/articles/2018/01/29/what-makes-kids-autism-less-social-their-typically-developing-peers
Veteran and community college transfer student heads to UCLA for graduate studies,"When he joined the U.S. Navy in 2010, Mychal Valle didn’t think he would ever return to school. After all, he got to work on new radar technologies in the navy and got recognized for writing technical manuals. But by the time he left the navy in 2016, Valle’s service helped him discover his passion: a career in science.",https://news.ucr.edu/articles/2021/05/24/veteran-and-community-college-transfer-student-heads-ucla-graduate-studies
New funding will help UCR diversify physician workforce in inland Southern California,"The California Wellness Foundation has awarded the School of Medicine a $450,000 grant",https://news.ucr.edu/articles/2021/06/01/new-funding-will-help-ucr-diversify-physician-workforce-inland-southern
UCR admits most California freshmen among UCs,"UC Riverside has admitted a record number of freshmen for fall 2021 with a total of 34,671 admits — an increase of 1,964 students from the year before, according to data released by the University of California on July 19.",https://news.ucr.edu/articles/2021/07/20/ucr-admits-most-california-freshmen-among-ucs
UC Riverside’s FIERCE Scholars are diversifying the Inland Empire teacher workforce,A gift from SchoolsFirst Federal Credit Union to UC Riverside School of Education is funding a program to get local education students into graduate or credential programs,https://news.ucr.edu/articles/2022/03/11/uc-riversides-fierce-scholars-are-diversifying-inland-empire-teacher-workforce
$3 million grant aims to prolong life for dialysis patients,The five-year survival rate for people on dialysis is under 50 percent. University of California researchers are hoping to improve that prognosis. ,https://news.ucr.edu/articles/2021/06/01/3-million-grant-aims-prolong-life-dialysis-patients
New York Times analysis notes UCR's student success,The New York Times and Urban Institute compared similar colleges in determining which schools are exceeding student success expectations - and which schools aren't meeting them.,https://news.ucr.edu/articles/2019/05/29/new-york-times-analysis-notes-ucrs-student-success
Oregon state leader with passion for student success to lead Undergraduate Education,"Jennifer Brown has been named vice provost and dean of Undergraduate Education at UCR, effective Aug. 1, 2018",https://news.ucr.edu/articles/2018/05/16/oregon-state-leader-passion-student-success-lead-undergraduate-education
UC Riverside Police Officer Association and University Neighborhood Enhancement Team (UNET) redefine holiday giving,Inspiration leads officers to surprise local children with holiday cheer,https://news.ucr.edu/articles/2018/01/10/uc-riverside-police-officer-association-and-university-neighborhood-enhancement
University innovation alliance executive director to lead event at UCR,Bridget Burns to discuss the future of higher education and UC Riverside's role in influencing change,https://news.ucr.edu/articles/2018/01/10/university-innovation-alliance-executive-director-lead-event-ucr
Chemicals in your living room cause diabetes in mice,A new UC Riverside study shows flame retardants found in nearly every American home cause mice to give birth to offspring that become diabetic.,https://news.ucr.edu/articles/2020/11/10/chemicals-your-living-room-cause-diabetes-mice
Governor’s budget proposal allocates $25 million for UCR School of Medicine,Additional ongoing funding would help the medical school expand enrollment,https://news.ucr.edu/articles/2020/01/10/governors-budget-proposal-allocates-25-million-ucr-school-medicine
State OKs $25M to double UCR medical students,Budget allocates ongoing funding to the medical school,https://news.ucr.edu/articles/2020/06/30/state-oks-25m-double-ucr-medical-students
New pathway facilitates community college students joining UC Riverside medical school,"The School of Medicine at the University of California, Riverside, has received a grant of $1.87 million to establish the Inland Empire Regional Hub for Healthcare Opportunity, or IE RHHO, which will create a pre-med pathway for local community college students.",https://news.ucr.edu/articles/2022/06/28/new-pathway-facilitates-community-college-students-joining-uc-riverside-medical
Gift to School of Medicine aims to alleviate inland Southern California’s physician shortage,Inland Empire Health Plan’s gift of $2.6M will create up to 23 awards designed to encourage students to practice in the region,https://news.ucr.edu/articles/2020/07/30/gift-school-medicine-aims-alleviate-inland-southern-californias-physician
Experts on Cicadas,"Cicadas For fast access to experts, TEXT or call the 24-hour-experts hotline at 951-312-3049, or email news@ucr.edu.",https://news.ucr.edu/articles/2021/05/24/experts-cicadas
Vaccine exemption process detailed,"This past week, UCR announced an Aug. 16 deadline for UC Riverside employees and students to upload vaccination records for fall 2021. The message was a follow-up to the UC system’s announcement of a SARS-CoV-2 Vaccination Program that would require vaccinations for employees and students to be on campus for fall 2021.",https://news.ucr.edu/articles/2021/07/28/vaccine-exemption-process-detailed
Experts on anti-Asian racism and violence,"Anti-Asian Racism and Violence For fast access to experts, TEXT or call the 24-hour-experts hotline at 951-312-3049, or email news@ucr.edu.",https://news.ucr.edu/articles/2021/04/07/experts-anti-asian-racism-and-violence
UC responds to Prop 16 outcome,"As California voters again voted down affirmative action, the University of California and UC Riverside affirmed their commitment to building the system’s underrepresented student population. Proposition 16, which failed 56.1% to 43.9%, would have repealed 1996’s Proposition 209, which— among other things—banned the consideration of race, ethnicity, and gender in college admissions decisions.",https://news.ucr.edu/articles/2020/11/04/uc-responds-prop-16-outcome
UC officials applaud Supreme Court's DACA decision,"University of California officials applauded on Thursday the U.S. Supreme Court’s decision to strike down the Trump administration’s attempt to end a program that allowed 650,000 Deferred Action for Childhood Arrivals, or DACA, recipients to live and work in the country.",https://news.ucr.edu/articles/2020/06/18/uc-officials-applaud-supreme-courts-daca-decision
Experts on the Academy Awards,"  The Oscars For fast access to experts, TEXT or call the 24-hour-experts hotline at 951-312-3049, or email news@ucr.edu  The 94th Oscars will air live on ABC on Sunday, March 27, 2022. The 94th Oscars will allow the entertainment community and fans from around the world to witness the night’s glamour and glory. Experts from the University of California, Riverside are available to discuss various Academy Awards topics, including acting, theatre, screenwriting, gender, culture, and more. ",https://news.ucr.edu/articles/2022/03/08/experts-academy-awards
$20M sustainable nanotechnology partnership renewed,"The National Science Foundation, or NSF, has renewed funding for a UC Riverside laboratory solving big environmental and agricultural challenges with very small chemical particles called nanomaterials.",https://news.ucr.edu/articles/2020/07/07/20m-sustainable-nanotechnology-partnership-renewed
Mystery of four-stranded DNA begins to unravel,"DNA is usually depicted as double-stranded, but not much is known about parts of the genome that adopt four-stranded structures known as quadruplexes. UC Riverside researchers have discovered that they play a key role in keeping cells healthy. ",https://news.ucr.edu/articles/2021/03/18/mystery-four-stranded-dna-begins-unravel
"Experts on Warehouses, Amazon, and Labor","Experts on Warehouses, Amazon, and Labor Ellen Reese, professor of sociology  ",https://news.ucr.edu/articles/2022/03/18/experts-warehouses-amazon-and-labor
"Injections for diabetes, cancer could become unnecessary","Researchers at UC Riverside are paving the way for diabetes and cancer patients to forget needles and injections, and instead take pills to manage their conditions. ",https://news.ucr.edu/articles/2022/11/10/injections-diabetes-cancer-could-become-unnecessary
No Thanksgiving for bacteria or fungus,UC Riverside scientists have developed a technique for solving a decades-old mystery involving the chemical in turkey that makes people sleepy. Their new ability to map the atoms involved in the production of tryptophan opens the door to new antibiotic and antifungal drugs.,https://news.ucr.edu/articles/2022/03/10/no-thanksgiving-bacteria-or-fungus
Scientists discover potential cause of Alzheimer’s Disease,Prevailing theories posit plaques in the brain cause Alzheimer’s disease. New UC Riverside research points to cells’ slowing ability to clean themselves as the likely cause of unhealthy brain buildup. ,https://news.ucr.edu/articles/2021/11/29/scientists-discover-potential-cause-alzheimers-disease
Light-powered soft robots could suck up oil spills,"A floating, robotic film designed at UC Riverside could be trained to hoover oil spills at sea or remove contaminants from drinking water.",https://news.ucr.edu/articles/2021/12/02/light-powered-soft-robots-could-suck-oil-spills
UCR Ecologist Receives Ecological Society of America Fellowship,"Loralee Larios, an assistant professor and plant ecologist, is one of only 10 researchers nationwide to receive the Ecological Society of America’s prestigious 2021 Early Career Fellowship. ",https://news.ucr.edu/articles/2021/04/23/ucr-ecologist-receives-ecological-society-america-fellowship
UC Riverside crests 76% for six-year graduation rate,"In the past six years, UC Riverside's six-year graduation rate has improved by 10 percentage points",https://news.ucr.edu/articles/2020/01/10/uc-riverside-crests-76-six-year-graduation-rate
$10 million grant will study children's religious views,A $10 million grant to psychology researcher Rebekah Richert will fully implement a network of international researchers who will study how religion impacts children’s world views.,https://news.ucr.edu/articles/2020/02/19/10-million-grant-will-study-childrens-religious-views
L.A. Times spotlights move to protect ‘Noah’s Ark of citrus’,Citrus greening has made its way to Riverside and is spreading. The L.A. Times features UCR researchers fighting to protect the 22-acre Citrus Variety Collection,https://news.ucr.edu/articles/2020/02/19/la-times-spotlights-move-protect-noahs-ark-citrus
Double bubbles pierce with less trouble,Two optical cavitation bubbles penetrate soft materials better than one,https://news.ucr.edu/articles/2020/04/29/double-bubbles-pierce-less-trouble
"Why Venus rotates, slowly, despite sun’s powerful grip","If not for the soupy, fast-moving atmosphere on Venus, Earth’s sister planet would likely not rotate. Instead, Venus would be locked in place, always facing the sun the way the same side of the moon always faces Earth.",https://news.ucr.edu/articles/2022/04/20/why-venus-rotates-slowly-despite-suns-powerful-grip
Managing earthquakes triggered by oil production,A team of scientists has developed an approach to disposing wastewater that reduces the danger of triggering an earthquake.,https://news.ucr.edu/articles/2021/07/28/managing-earthquakes-triggered-oil-production
"UCR faculty, staff, and alumni will be at the LA Times Festival of Books","This year’s Los Angeles Times Festival of Books includes a UC Riverside star-studded lineup.  Nineteen UCR faculty, staff, and alumni will be participating in this annual literary event that takes place at the University of Southern California. More than 550 authors, poets, artists, chefs, celebrities, and musicians will gather on April 23-24. See full details: LA Times Festival of Books. ",https://news.ucr.edu/articles/2022/04/20/ucr-faculty-staff-and-alumni-will-be-la-times-festival-books
"Amir Zaki publishes 23 years of photography in new monograph, ‘Building+Becoming’ ",The book weaves stories that capture both nature and architecture. It goes on sale on April 26 ,https://news.ucr.edu/articles/2022/04/20/amir-zaki-publishes-23-years-photography-new-monograph-buildingbecoming
"Study explores why children remember the same things, differently",Children less able to manage their emotions don't remember details of frightful events,https://news.ucr.edu/articles/2018/09/10/study-explores-why-children-remember-same-things-differently
Experts weigh in on whether COVID-19 is here to stay,"COVID-19 is far from beaten. Vaccines may not be the ultimate panacea to haul us out of the pandemic crisis. In the future, will outbreaks of SARS-CoV-2, the virus that causes COVID-19, arrive in waves every winter? Might COVID-19 never go away? Experts at the University of California, Riverside, weigh in.",https://news.ucr.edu/articles/2021/02/17/experts-weigh-whether-covid-19-here-stay
"For children with autism, strong bonds with teachers are key to success",UC Riverside's Jan Blacher is leading the charge to improve relationships between kids with autism and their teachers,https://news.ucr.edu/articles/2018/09/10/children-autism-strong-bonds-teachers-are-key-success
Riverside named a top city for entrepreneurs,Riverside outranks the better-known entrepreneurship hotspot of San Jose,https://news.ucr.edu/articles/2018/09/10/riverside-named-top-city-entrepreneurs
Statement on dismissal of tenured faculty member,"Today the Regents of the University of California voted to dismiss a tenured professor, who had been on unpaid suspension, for violating the Faculty Code of Conduct due to sexual misconduct with a student over whom they had academic responsibility. This decision was consistent with the recommendation of the UC Riverside Academic Senate Privilege and Tenure Committee, UC Riverside Chancellor Kim A. Wilcox, and President Michael Drake.",https://news.ucr.edu/articles/2021/11/19/statement-dismissal-tenured-faculty-member
How COVID-19 is affecting the global supply chain,"One of the most visible impacts of the coronavirus pandemic has been the strain on the global supply chain, with consumers noticing certain goods are harder to find at their local store. Danko Turcic, an associate professor of operations and supply chain management at UC Riverside’s School of Business, said the current environment is causing “previously unseen disruptions in both supply and demand.”",https://news.ucr.edu/articles/2020/04/29/how-covid-19-affecting-global-supply-chain
The Colorado River is imperiled; why it matters to you,UC Riverside experts discuss the decline of this major water source for nearly 40 million people in seven states.,https://news.ucr.edu/articles/2022/11/10/colorado-river-imperiled-why-it-matters-you
Tomás Rivera Conference continues online,"Weekly programs surrounding Latino/a literature, identities, race, and more, run through early November.",https://news.ucr.edu/articles/2020/10/10/tomas-rivera-conference-continues-online
A 50th anniversary celebration for Tomás Rivera’s seminal book: ‘Y no se lo tragó la tierra’,"The free, virtual events will culminate with an inaugural Tomás Rivera Book Prize.",https://news.ucr.edu/articles/2021/04/12/50th-anniversary-celebration-tomas-riveras-seminal-book-y-no-se-lo-trago-la
UCLA Leader Named as Dean of Bourns College of Engineering,A UCLA engineering leader with a vision for UC Riverside’s ability to meet California’s STEM needs has been named the new dean of the Marlan and Rosemary Bourns College of Engineering. Christopher S. Lynch will join Bourns as dean on September 1. Lynch is the chair of the UCLA Samueli School of Engineering’s Mechanical and Aerospace Engineering Department.,https://news.ucr.edu/articles/2018/04/04/ucla-leader-named-dean-bourns-college-engineering
UCLA leader named dean of Bourns College of Engineering,A UCLA engineering leader with a vision for UC Riverside’s ability to meet California’s STEM needs has been named the new dean of the Marlan and Rosemary Bourns College of Engineering. Christopher S. Lynch will join Bourns as dean on September 1. Lynch is the chair of the UCLA Samueli School of Engineering’s Mechanical and Aerospace Engineering Department.,https://news.ucr.edu/articles/2018/04/04/ucla-leader-named-dean-bourns-college-engineering-0
$10 sensor reduces brewers’ natural gas use,"$45,000 UC Riverside investment helps researchers win $1.5 million grant",https://news.ucr.edu/articles/2018/02/05/10-sensor-reduces-brewers-natural-gas-use
A new approach to targeting cancer cells,UC Riverside researchers develop new drugs that target therapeutically relevant protein surfaces,https://news.ucr.edu/articles/2019/05/17/new-approach-targeting-cancer-cells
Scientists profile FDA-approved drugs to potentially treat hundreds of genetic disorders,New method developed by UC Riverside researchers quickly assesses drug potential for rare disorders,https://news.ucr.edu/articles/2022/02/03/scientists-profile-fda-approved-drugs-potentially-treat-hundreds-genetic
High-tech air quality research center dedicated in Riverside,"The California Air Resources Board dedicated its new state-of-the-art Southern California headquarters Thursday, Nov. 18, on a 19-acre site near the UC Riverside campus. The 402,000-square-foot laboratory and office facility, located on land provided by UCR, is one of the largest and most advanced vehicle emissions testing and research facilities in the world, agency officials said.",https://news.ucr.edu/articles/2021/11/19/high-tech-air-quality-research-center-dedicated-riverside
Experts discuss the ‘coming out’ of nonbinary people,UCR experts say Demi Lovato’s public announcement amplifies the conversation about gender identity.,https://news.ucr.edu/articles/2021/06/09/experts-discuss-coming-out-nonbinary-people
Optical pre-processing makes computer vision more robust and energy efficient,Hybrid neural network can reconstruct Arabic or Japanese characters that it hasn’t seen before,https://news.ucr.edu/articles/2020/12/11/optical-pre-processing-makes-computer-vision-more-robust-and-energy-efficient
How concerned should we be about the Delta variant?,UC Riverside experts share their thoughts,https://news.ucr.edu/articles/2021/06/30/how-concerned-should-we-be-about-delta-variant
It's more than hot. It's dangerous.,"It's the time of year when Inland Southern California becomes a 27,000-square-mile skillet. We asked UC Riverside physicians how to stay safe and hydrated.",https://news.ucr.edu/articles/2021/07/07/its-more-hot-its-dangerous
Sending kids back to school: is it too soon?,"After more than a year of lockdown, school is back in session. But many people are wondering whether it should be. Here, UC Riverside experts in viruses, medical policy and education share their thoughts about whether in-person learning at this moment in time is an A+ idea, and offer ideas about how to move forward.",https://news.ucr.edu/articles/2021/08/26/sending-kids-back-school-it-too-soon
Professor creates artist residency for veterans and COVID-19 frontline workers ,"When the coronavirus pandemic hit, Charles Evered, a professor of playwriting at the University of California, Riverside, began to think about how he could help. He fell back on what he knows: supporting artists. His nonprofit organization, the Evered House, honors his late father, Charles J. Evered, a World War II Army Air Corpsman who succumbed to lung cancer over 40 years ago. ",https://news.ucr.edu/articles/2020/06/23/professor-creates-artist-residency-veterans-and-covid-19-frontline-workers
Why is it taking so long to approve a COVID-19 vaccine for kids?,UC Riverside vaccine expert David Lo explains,https://news.ucr.edu/articles/2021/09/21/why-it-taking-so-long-approve-covid-19-vaccine-kids
UCR experts weigh drought's long-term impacts,"Gov. Gavin Newsom declared a drought emergency for the entire state of California this past month. The period from Oct. 1, 2020 to Sept. 30, 2021 was the second-driest year on record in California. Almost 90% of the state is in throes of extreme drought. Reservoir storage is 60% of average. Said one state water official: ""It's almost beyond comprehension."" We asked UCR experts what the future holds if drought conditions persist. Hoori Ajami, groundwater hydrologist ",https://news.ucr.edu/articles/2021/11/18/ucr-experts-weigh-droughts-long-term-impacts
