title,description,url
Apply,"Graduate school is a big commitment on your part, so choosing the right graduate program is an important decision. Explore the 50+ graduate programs offered at Riverside. Talk to our graduate programs' coordinators and faculty to see if this will be the right fit for you. We understand that applying involves coordinating and providing the required application materials, so feel free to use the below information and links to help you build your graduate application to UCR.  ",https://graduate.ucr.edu/apply
"Academic Preparation, Recruitment & Outreach",APRO,https://apro.ucr.edu/
OSAR Consortium,"Overview CE-CERT has launched the Onboard Sensing, Analysis and Reporting (OSAR) Consortium. In partnership with academia, industry, and government agencies, the OSAR Consortium program of research will investigate the feasibility and efficiency of in-use emission regulations premised on reliable on-board continuous emissions measurement and reporting systems that can lead to attainment of significantly improved air quality standards in environmentally impacted areas. Under the leadership of OSAR Consortium Director, Dr.",https://www.cert.ucr.edu/osar-consortium
Resources,Resources The Provost and Executive Vice Chancellor is responsible for a broad portfolio of initiatives and ongoing projects related to the academic enterprise. Resources for those initiatives and projects can be found here.  5-year Academic Calendar Use the link below to access the Five Year Academic Calendar provided by the Registrar's Office. ,https://provost.ucr.edu/resources
Commencement 2023,Celebrate UCR's 69th Commencement,https://commencement.ucr.edu/
Why the NBA is seeking technology built by UCR students and alumni,"EDGE Sound Research, co-founded by a student and an alum, was one of seven companies from around the world selected for the NBA Launchpad program.",https://news.ucr.edu/articles/2023/03/21/why-nba-seeking-technology-built-ucr-students-and-alumni
New Vice Provost & Dean of Graduate Studies named,"Lidia Kos has been named UC Riverside’s next vice provost & dean of graduate studies, or VPDGS, effective July 15, 2023.",https://news.ucr.edu/articles/2023/03/24/new-vice-provost-dean-graduate-studies-named
New center to study labor issues in the Inland Empire,Inland Empire Labor and Community Research Center at UC Riverside is one of five UC centers meant to advance timely labor research.,https://news.ucr.edu/articles/2023/04/17/new-center-study-labor-issues-inland-empire
2023 Graduate Division's Summer Programs - Faculty Interest Form, ,https://grad.ucr.edu/register/form?id=4ebdcab5-b3a3-428c-8743-e7e83587a25c
Commencement Staffing,"Make a Difference at Commencement! UCR staff members, students, retirees, and parents are invited to celebrate with the Class of 2023 at UC Riverside's 69th Commencement. Over 6,000 graduates are expected to attend, along with their proud family members and friends.",https://commencement.ucr.edu/volunteers
UCR Profiles - Search & Browse,Search & Browse UCR Faculty & Staff,https://profiles.ucr.edu/app/home/profile/bradleyb
How to create a paradigm shift in vehicle emission regulation,AUTHOR: HOLLY OBER,https://www.cert.ucr.edu/news/2020/05/28/how-create-paradigm-shift-vehicle-emission-regulation
Transfer Admission Guarantee,"With UC Riverside’s Transfer Admission Guarantee (TAG), California Community College students who meet certain course and GPA requirements can secure their spot at UCR!",https://admissions.ucr.edu/transfer/transfer-admission-guarantee
Dr. Tom Fryer - UC Riverside,"EDUCATION DBA, Canterbury  ",https://engineeringonline.ucr.edu/faculty/dr-tom-fryer/
Process and Timeline,Summary of Strategic Plan Development Process The strategic planning process was based on the work of committees with representatives from across campus. Committees explored their topics by engaging deeply with the community and analyzing input from stakeholders. Each committee wrote a report on their topic that considers a set of cross-cutting themes. Read below for more detail on each phase of development for the Strategic Plan. ,https://strategicplan.ucr.edu/process-and-timeline
Undergraduate Admissions,Bold Hearts. Brilliant Minds.,https://admissions.ucr.edu/blog
2020-21,UC Riverside's Major Preparation Guide outlines the selecting major requirements that must be satisfied for your desired major.,https://admissions.ucr.edu/transfer/majors-preparation-guide/2020-21
Undergraduate Admissions Statement of Privacy Practices,"TRANSPARENCY REGARDING THE USE OF YOUR PERSONAL DATA As part of our commitment to protecting your privacy, this statement is designed to provide you with information regarding how UC Riverside (“UCR”) Undergraduate Admissions, part of UC Office of the President, collects and processes the information you share when you use our website located at admissions.ucr.edu, and each of its associated domains (together, the “Sites”), utilize the services of ours which include providing information to prospective UCR undergraduate applicant",https://admissions.ucr.edu/privacy-policy
Bioengineering Careers | MSE Online Program | UC Riverside,"Biomedical engineering graduate programs can lead to a many career paths: Pharmaceutical Engineer, Medical Device Engineer, Medical Scientist, and more.",https://engineeringonline.ucr.edu/bioengineering/bioengineering-careers/
UCR Profiles - Search & Browse,Search & Browse UCR Faculty & Staff,https://profiles.ucr.edu/app/home/profile/kjohnson
College of Natural and Agricultural Sciences,"From insects to environmental impacts, learn how to save the world in UC Riverside's College of Natural and Agricultural Sciences.",https://admissions.ucr.edu/colleges/college-of-natural-and-agricultural-sciences
School of Education,"Learn how to inspire others at UCR's School of Education's Education, Society, and Human Development Undergraduate Program.",https://admissions.ucr.edu/colleges/school-of-education
"College of Humanities, Arts, and Social Sciences","Find yourself at home in the world by choosing a major offered by UC Riverside's College of Humanities, Arts, and Social Sciences (CHASS).",https://admissions.ucr.edu/colleges/college-humanities-arts-and-social-sciences
Marlan and Rosemary Bourns College of Engineering,UC Riveside's Marlan and Rosemary Bourns College of Engineering (BCOE) develops the skills needed to engineer the future.,https://admissions.ucr.edu/colleges/marlan-and-rosemary-bourns-college-of-engineering
School of Public Policy,UC Riverside's School of Public Policy will teach you how to solve issues that impact the region and the world.,https://admissions.ucr.edu/colleges/school-public-of-policy
School of Business,UC Riverside's School of Business will help you become a leader in the global marketplace.,https://admissions.ucr.edu/colleges/school-of-business
School of Medicine,"UC Riverside's School of Medicine motivates the next generation of medical professionals ready to save lives, from biomedical scientists or a doctor of medicine.",https://admissions.ucr.edu/colleges/school-of-medicine
Jiayu Liao - UC Riverside,"EDUCATION Ph.D., Biological Chemistry, University of California, Los Angeles, 1999  ",https://engineeringonline.ucr.edu/faculty/jiayu-liao/
Living-Learning Communities,  A Living-Learning Community (LLC) offers a unique opportunity for students with common interests and/or identities to live together.,https://housing.ucr.edu/living-at-ucr/living-learning-communities
Campus Tours FAQ,"We’ve anticipated many of your campus tour questions and tried to answer them. If you have additional questions, please contact us tour@ucr.edu.  ",https://admissions.ucr.edu/campus-tours-faq
Undergraduate Minors,"No matter what your college major, you can increase your marketability as a professional by adding an Education minor to your degree. SOE offers two minors: Education and Athletic Leadership.",https://education.ucr.edu/undergraduate-minors
Community Engaged Learning,"Community Engaged Learning  The School of Education requires undergraduate Education, Society, and Human Development (ESHD) majors to complete 40 hours of Community Engaged Learning as a critical component of the degree requirement. The goal of Community Engaged Learning is to enrich and extend the UCR coursework experience with applied, real-world learning addressing community-identified concerns.",https://education.ucr.edu/community-engaged-learning
 - HighlanderLink,"Discover unique opportunities at HighlanderLink! Find and attend events, browse and join organizations, and showcase your involvement.",https://highlanderlink.ucr.edu/organization/umoja
Undergraduate Education Students,"Welcome! Welcome to the School of Education’s undergraduate advising office. As you navigate your undergraduate studies, our student support staff are here to answer questions you may have about university policy and procedures, provide academic advice, and help you achieve your academic goals.",https://education.ucr.edu/undergraduate-education-students
School of Medicine Medical Scholars Program,Helping Undergraduates to Careers in Health & Biomedical Sciences,https://msp.ucr.edu/
School of Medicine Medical Leaders of Tomorrow,Providing Young People With Early Exposure to Careers in Health,https://mlt.ucr.edu/
Academic Advising,Academic Advising ,https://education.ucr.edu/academic-advising
Community Engaged Learning Opportunities,Community Engaged Learning Opportunities   Below you will find the Spring/Summer Opportunities.,https://education.ucr.edu/community-engaged-learning-opportunities
404 - Content Not Found,"We're Sorry, The requested object or URL could not be found. The link you followed is either outdated, inaccurate, or has been removed. Please visit the homepage to get back on track.",https://transfer.engr.ucr.edu/support/TTP
AskUCR,Your Student Resource Hub,https://ask.ucr.edu/
Admission to Biomedical Sciences Programs,"The Division of Biomedical Sciences offers a Ph.D., combined M.D./Ph.D., or M.S. degrees to students through an interdisciplinary, translational research program that incorporates a medical school curriculum with basic science training. Our students become independent research scientists with skills that allow them to bridge the wide gulfs that exist between clinical medicine and basic science research. Prospective students should apply to the Ph.D. and M.S. programs through the Graduate Division website.",https://somsa.ucr.edu/admission-biomedical-sciences-programs
Outside Scholarships for Pathway Students,This information on outside scholarships has been compiled as a resource for Pathway Program students looking for additional funding.,https://somsa.ucr.edu/outside-scholarships-pathway-students
Returning & Continuing Students,"Check with your graduate program for eligibility requirements and program details prior to submitting an online application for any of the returning or continuing application options. Leave of Absence To request a leave of absence from graduate studies for 1 - 3 quarters, log into R'Grad to access the Leave of Absence form.",https://graduate.ucr.edu/returning-continuing-students
404 - Content Not Found,"We're Sorry, The requested object or URL could not be found. The link you followed is either outdated, inaccurate, or has been removed. Please visit the homepage to get back on track.",https://education.ucr.edu/sites/default/files/2021-10/IGETC%2520Overview.pdf%2520
General Advising,"UC Riverside is comprised of six undergraduate colleges. Each college provides unique services to support the needs of our students – from academic advising, career services, academic support services, learning communities, research opportunities, social events and leadership initiatives.",https://ue.ucr.edu/general-advising
404 - Content Not Found,"We're Sorry, The requested object or URL could not be found. The link you followed is either outdated, inaccurate, or has been removed. Please visit the homepage to get back on track.",https://education.ucr.edu/sites/default/files/2021-10/2Y-Plan_EdMajorTransfers.pdf%2520
Selectives,"Selectives are stand-alone courses outside of the standard curriculum of the School of Medicine that allow students to create a customized, independent experience. Selectives are generally taught in small groups and cover a variety of specialized topics. For more information on selectives, please contact School of Medicine Registrar Cheri Black at (951) 827-4334 or cheri.black@medsch.ucr.edu.",https://ume.ucr.edu/selectives
University Honors,Come Here Go Anywhere,https://honors.ucr.edu/people
Academic Advising,"The UCR School of Business students are supported by academic advisors that help with major changes, plans, petition, articulation review, and degree audits.",https://business.ucr.edu/undergraduate/advising
School of Medicine Graduate Medical Education,"Teaching skills, cultural competence and community health-based healthcare",https://gme.ucr.edu/
Undergraduate Program,UCR School of Public Policy,https://spp.ucr.edu/undergraduate
Academy of Distinguished Teaching,Teaching Excellence,https://academyteachers.ucr.edu/
Prestigious Scholarships and Awards,"UCR undergraduate students are encouraged to review the award listings to determine the best award that meets their interests and long-term goals. Interested students should consider attending any of our Student Engagement Information Sessions as early as their sophomore year. These sessions will provide guidance on selecting recommenders, preparing compelling personal statements, interviewing, and developing a project proposal or proposed program of study. ",https://engage.ucr.edu/awards/overview
CHASS Student Academic Affairs,Guiding Your Academic Success,https://chassstudentaffairs.ucr.edu/
Intern at UC Centers in DC or Sacramento,"Capital Internship program at UC Riverside provides a variety of opportunities for eligible students to earn course credit for substantive internships associated with their academic and career goals. Since these programs are academic in nature, the Office of Student Engagement strives to facilitate partnerships that lead to tangible learning opportunities for students, and significance for our community partners. The Capital Internship program is designed to function as an outlet to grow professionally within your career field, but also to enhance academic learning. The educational value is exhibited through research, student learning objectives, professional and academic guidance from a faculty advisor and internship site supervisor, and the opportunity to successfully link theoretical knowledge from a class-room to real-world experiences.Capital Internship program at UC Riverside provides a variety of opportunities for eligible students to earn course credit for substantive internships associated with their academic and career goals. Since these programs are academic in nature, the Office of Student Engagement strives to facilitate partnerships that lead to tangible learning opportunities for students, and significance for our community partners. The Capital Internship program is designed to function as an outlet to grow professionally within your career field, but also to enhance academic learning. The educational value is exhibited through research, student learning objectives, professional and academic guidance from a faculty advisor and internship site supervisor, and the opportunity to successfully link theoretical knowledge from a class-room to real-world experiences.",https://engage.ucr.edu/internship/overview
MyHousingPortal,The StarRez Portal provides students with everything they need to manage their housing applications and other related services.,https://ucr.starrezhousing.com/StarRezPortal/40FF5A24/1/1/Home-MyHousingPortal?UrlToken=DFE47378
Original topics. Student-led. Discussion-based.,"R’Courses: Pioneering Our Curriculum In December 2014, the UCR Academic Senate approved the offering of student-initiated courses, also known as R’Courses. These student-initiated courses designed by undergraduates and taken by other undergraduates at UCR are based on the idea of Democratic Education; creating a community of equals, upholding values such as social justice, respect, and active and engaging participation.",https://engage.ucr.edu/rcourses/overview
Get Involved,"Connecting UCR Students to the Community UCR has a campus culture dedicated to service and engagement of the community. The Office of Student Engagement within Undergraduate Education is working with Student Life and other campus partners to expand and track opportunities for students to get involved in community service, service learning through courses, community academic internships, and community-based research.",https://engage.ucr.edu/engagement/overview
Undergraduate Research,UCR Undergraduate Research,https://engage.ucr.edu/research/overview
Coronavirus,"Coronavirus (COVID-19) Background, news, and resources about UC Riverside's response to COVID-19. For announcements on the latest news, updates, resources, and guidance documents refer to the campus COVID-19 announcements.",https://ehs.ucr.edu/coronavirus
Engaged Learning,Distinguish Yourself,https://engage.ucr.edu/
Teacher Education Program Scholarships,"Teacher Education Program Scholarships Below is a list of scholarships and requirements available for students who are pursuing UCR’s teaching credential or M.Ed. with credential programs. For information about financial aid, please refer to UCR's financial aid department.",https://education.ucr.edu/tep/teacher-education-program-scholarships
Scholarship Opportunities,Scholarship Opportunities for CNAS Students Please review the information below for available scholarships during the academic year.   You may also visit  scholarships.ucr.edu for more scholarship opportunities at UCR.   For information about Regents or Chancellor's scholarships please contact the Financial Aid Office.  ,https://cnasstudent.ucr.edu/scholarship-opportunities
Where Can a Public Policy Degree Take You?,Where Can a Public Policy Degree Take You? UCR School of Public Policy alumni,https://spp.ucr.edu/where-can-public-policy-degree-take-you
Engaged Learning,Distinguish Yourself,https://engage.ucr.edu/news
Scholarships,UCR School of Public Policy Scholarships,https://sppstudents.ucr.edu/undergraduate-students/scholarships
School of Public Policy,Consilium,https://consilium.ucr.edu/
Roosevelt Network,who writes the rules matters,https://roosevelt.ucr.edu/
Current Undergraduate Students,UCR School of Public Policy Undergraduate Students,https://sppstudents.ucr.edu/undergraduate-students
Inland Center for Sustainable Development,A research center of the UCR School of Public Policy,https://icsd.ucr.edu/
School of Public Policy,"Solutions for the Region, Solutions for the World",https://spp.ucr.edu/
Center of Crime and Justice Studies,A research center of the UCR School of Public Policy,https://presleycenter.ucr.edu/
Fundraising effort seeks to aid at-risk Afghan scholars   ,"Public donations will help scholars fleeing from danger, offer them safety .",https://news.ucr.edu/articles/2021/10/04/fundraising-effort-seeks-aid-risk-afghan-scholars
School of Public Policy,SPP Student Affairs,https://sppstudents.ucr.edu/
Summer,"Summer Session Please review the Summer Enrollment Guide below for general information about taking classes during the summer term, whether at UCR or other institutions.  Please consult with your academic advisor for more details.",https://cnasstudent.ucr.edu/summer
Frameworks for Action,"The Center for Social Innovation at UCR (CSI) provides a credible research voice that spurs civic leadership and policy innovation. Its reputation is built on the key pillars of social science, strategic policy awareness, innovation mindsets, and deep community partnerships. ",https://socialinnovation.ucr.edu/frameworks
"Planned Giving Home | University of California, Riverside","UCR is one of the most diverse, inclusive institutions within the prestigious 10 campus University of California system, UCR serves as an incubator of new knowledge, an engine of social mobility, and an economic powerhouse.",https://planmygift.ucr.edu/
Events,UCR School of Public Policy Events,https://spp.ucr.edu/about/events
404 - Content Not Found,"We're Sorry, The requested object or URL could not be found. The link you followed is either outdated, inaccurate, or has been removed. Please visit the homepage to get back on track.",https://studentwellness.ucr.edu/student-success-resources
Current Student Enrollment,"  General Information It is important to note upcoming changes with regard to our UCR internal campus systems. GROWL is no longer available and students must utilize R'Web self-service. R'Web self-service connects you directly to academic history, class registration, R'Mail, transcript and verification, iLearn, iGrade, Authorized User, and more.",https://cnasemc.ucr.edu/current-student-enrollment
Concurrent Enrollment,Fall 2021 Concurrent Enrollment is planned to operate using a modified approval process given the mandated campus closure. Prospective students should monitor this page for additional updates.,https://extension.ucr.edu/helpcenterstudentresources/registration/concurrentenrollment
"Learn About Us - Contact Us | University of California, Riverside","UCR is one of the most diverse, inclusive institutions within the prestigious 10 campus University of California system, UCR serves as an incubator of new knowledge, an engine of social mobility, and an economic powerhouse.",https://planmygift.ucr.edu/?pageID=21
Work-Study,Work-Study,https://financialaid.ucr.edu/types-of-financial-aid/work-study
Updates to COVID-19 guidelines,"Dear Campus Community, As we approach the end of winter quarter, we write today to provide you with updates on COVID-19 health and safety guidelines on the UC Riverside campus. ",https://insideucr.ucr.edu/announcements/2022/03/11/updates-covid-19-guidelines
How to Stay Eligible,Six Ways to Stay Eligible for Financial Aid: You must do all seven to maintain eligibility!,https://financialaid.ucr.edu/apply/stay-eligible
CNAS Enrollment Management Center,CNAS EMC,https://cnasemc.ucr.edu/
VA Benefits,"Using your Veteran's Benefits at UCR Our VASCO (VA certifying official) has military-specific knowledge and experience to clearly explain and help you apply for Veteran's benefits, plus a variety of grants and scholarships. Follow these simple steps and UCR will begin creating a funding package customized to your eligibility:",https://veterans.ucr.edu/va-benefits
"Let Us Know About Your Gift | University of California, Riverside","UCR is one of the most diverse, inclusive institutions within the prestigious 10 campus University of California system, UCR serves as an incubator of new knowledge, an engine of social mobility, and an economic powerhouse.",https://planmygift.ucr.edu/?pageID=174
Holds,UC Riverside students may have holds placed on their accounts for a variety of reasons. Connect with the Registrar's Office to learn how to clear holds so you can register for classes on time.,https://registrar.ucr.edu/registering/holds
Cost,"Thanks to available benefits, scholarships, and grants, most student veterans pay little or nothing out of pocket to attend UC Riverside. One reason is because our Financial Aid office is dedicated to working with you, the VA, and UCR to help make sure you receive all the benefits for which you’re eligible. Apply now!",https://veterans.ucr.edu/cost
404 - Content Not Found,Financial Aid Events & Workshops,https://financialaid.ucr.edu/summer-financial-aid-application
Student Services,"The function of the Student Business Services (SBS) and Cashiers Department is to assist students in understanding their student account, loans, and to receive payments. Specifically, SBS provides answers to billing questions, payment options, loan debt entrance & exit counseling, and direct deposit authorization for refunds (available on R'Web).",https://sbs.ucr.edu/student-services
Communities,  Click on different tabs to see career related resources for student populations listed below.  ,https://careers.ucr.edu/communities
Avoid Scams and Fraud,"Beware of Fraud, Protect Your Privacy, Ask Questions While the Career Center does not knowingly accept fraudulent job postings, regrettably",https://careers.ucr.edu/students/student-jobs/avoid-scams-and-fraud
Building Connections,Tap into the Power of Networkin,https://careers.ucr.edu/resources/job-search-strategies/networking
R’Professional Career Closet,The R’Professional Career Closet is open in the,https://careers.ucr.edu/resources/job-search-strategies/rprofessional-career-closet
Tobacco Free Policy,UC Riverside is a Smoke/Tobacco-Free C,https://hr.ucr.edu/front/workplace-health-wellness/wellness/wellness-program-resources/tobacco-free/tobacco-free-policy
UCRAA Membership,"Forever Highlanders   UCR has a growing network of alumni across the globe, united by UCR’s world-class education. We invite you to join this powerful community of support, pride, and unity. Become a UCR Alumni Association member – it’s the next best thing to being back on campus.",https://alumni.ucr.edu/ucraa-membership
Resumes,Create an Effective R,https://careers.ucr.edu/resources/job-search-strategies/resumes
Career Center,Connect • Inspire • Empower,https://careers.ucr.edu/document/2022-23-highlander-family-orientation-presentation
R'Grad Professional Pathways, ,https://careers.ucr.edu/grad-students
Your Experience,"For more than 65 years, UCR University Extension has been rewarding and enriching students of all ages - from right here in Riverside to the far-flung reaches of the globe - through professional development, academic advancement, and personal achievement.",https://extension.ucr.edu/yourexperience/yourexperience
