title,description,url
Training & Tutorials,Training & Tutorials As training materials are developed for campus departments by the Business & Financial Services offices they will be added to this webpage. Additionally please refer to the UC Learning Center (formally LMS) for training on various campus systems and functions.,https://bfs.ucr.edu/training
Concur Access,Concur Access ,https://impact23.ucr.edu/concur-access
Human Resources,Helping employees maximize their potential,https://hr.ucr.edu/
Human Resources,Helping employees maximize their potential,https://hr.ucr.edu/
Human Resources,Helping employees maximize their potential,https://hr.ucr.edu/
Reporting Travel Expenses,"Quick Guide (January 2014) Accounting is committed to accurate and timely travel expense reimbursements via our online iTravel expense reporting system. Reporting travel expenses usually result in reimbursement payments to employees. It is the Accounting Office responsibility to provide a reliable travel expense reporting process, ensure travel expense reporting adheres to UC policy, and request clarifications to ensure travel expense reimbursements meet the IRS “Accountability Plan” requirements.",https://accounting.ucr.edu/travel-entertainment/reporting-travel-expenses
Setting up Associate Non-Employee Traveler (iTravel),Request a Non-Employee Traveler,https://accounting.ucr.edu/travel-entertainment/non-employee-traveler
Travel Coordinators Training,Travel Coordinators Training Return to Travel & Entertainment Announcement » Available Training,https://accounting.ucr.edu/travel-entertainment/travel-coordinators-training
Auxiliary Services,"UCR Auxiliary Services provide a host of essential services that enhance campus life for UC Riverside students, faculty, staff and the local community.",https://auxiliary.ucr.edu/
Payroll Calendars,Return to Payroll Coordination Home »,https://accounting.ucr.edu/payroll-coordination/payroll-calendars
Foreign Visitor Travel,Reimbursement for Travel and Incidental Expenses to Foreign Visiting Scholars,https://accounting.ucr.edu/travel-entertainment/foreign-visitor-travel
Car Rental & Auto Reimbursement,"Short-term Car Rental The University has car rental agreements for Hertz, Enterprise, and National. These rental agreements, for official University business, are available through Connexxus, UC’s Travel Program Portal, and offer value added benefits that include insurance coverage at no additional charge as well has honoring current promotional pricing available outside of our contract. The list below provides steps and consideration to take before arranging a rental car and obtaining reimbursement.",https://accounting.ucr.edu/travel-entertainment/car-rental-auto-reimbursement
eBuy PO Back-up,"PDF Version of this Quick Guide ePay PO Back-Up is used to document and approve invoices originating from a Purchase Order for meals, light refreshment, and related services connected to business meetings, entertainment, and other occasions. Steps to use ePay for Purchase Order back-up are located here: https://o365ucr.sharepoint.com/sites/BFS/Support/ePay/Pages/pobackup.aspx",https://accounting.ucr.edu/accounts-payable/ebuy-po-back
Human Resources,Helping employees maximize their potential,https://hr.ucr.edu/
Human Resources,Helping employees maximize their potential,https://hr.ucr.edu/
Holiday Pay,"    Eligibility for holiday pay is determined by the following criteria: the bargaining unit contract that governs the employee; otherwise, use  Absence from Work policy -PPSM 2.210 (staff) or APM 720 (academic). the employee's FLSA status (exempt vs. non-exempt) and",https://accounting.ucr.edu/payroll-coordination/holiday-pay
Creative Services,"Welcome to Creative Services, your on-campus source for academic printing, graphic design (for digital and print production), official UCR business cards and stationary, and more!",https://cbs.ucr.edu/creative-services
Campus Business Services,We Take Care Of Business,https://cbs.ucr.edu/
Early Childhood Services,"ECS supports children to reach their full potential in all developmental areas and provides them with a healthy, safe and inclusive learning environment.",https://ecs.ucr.edu/
Hospitality Services,Delicious | Nutritious | Sustainable,https://hospitality.ucr.edu/
Vendor Request,"PDF Version of this Quick Guide This guide outlines the general considerations in processing new vendor requests and current vendor changes through eBuy, ePay, and iTravel. The Accounts Payable unit is responsible for processing vendor requests and processes several thousand requests per year. Campus departments applying the below simple considerations will ensure that these vendor requests are processed routinely, accurately, completely, and timely.",https://accounting.ucr.edu/accounts-payable/vendor-request
Vendor Invoice Process,"PDF Version of this Quick Guide This guide outlines the general considerations in processing vendor invoices originating from POs (aka, DAPOs and Purchase Orders). The Accounts Payable unit processes over one hundred thousand vendor invoices annually. Campus departments applying the below simple considerations will ensure these invoices are processed routinely, accurately, completely, and timely.",https://accounting.ucr.edu/accounts-payable/vendor-invoice-process
CRATE by Citrus Grove Catering,"The CRATE menu provides our clients the freshest, most timely and seasonal ingredients throughout the year.",https://dining.ucr.edu/catering/crate-citrus-grove-catering
404 - Content Not Found,"We're Sorry, The requested object or URL could not be found. The link you followed is either outdated, inaccurate, or has been removed. Please visit the homepage to get back on track.",https://research.ucr.edu/webdocs/sp/laboratory-ramp-down-checklist-2020-03-17.pdf
Citrus Grove Catering,From beverage service and continental breakfast to barbecues and gala receptions; Citrus Grove Catering provides the finest menus and service to the university community.,https://dining.ucr.edu/catering/citrus-grove-catering
Caterers,"""Caterers"" are defined as food sources that are setting up, preparing or serving food or drinks on the campus. To use a caterer, you will need to follow Policy 5402 and Complete the Contracting Out Justification Form - https://hrms.ucr.edu/app/home. All catered events must be sent to Procurement Services as a requisition. Pre-Qualified, Off-Campus Caterers",https://procurement.ucr.edu/goods-services/caterers
Establishing a New Detail Code,There are two types of Detail Code Request Form - one for Financial Aid and one for Sales & Service. Departments must coordinate new Detail Code requests for student aid with the Grad Division or Financial Aid.,https://accounting.ucr.edu/general-accounting/new-detailcode
Departmental Billing,"One of the responsibilities of the Student Business Services (SBS) and Cashiers Department is to maintain the accounts receivable, billing, and collection of sundry debtor accounts for UCR. This is done with an integrated, central billing system currently processed on SIS+. Typically, these billings and accounts are from UCR departments who provide services and/or products to individuals or organizations.",https://sbs.ucr.edu/departmental-billing
AMS User Guide - Homepage,*/ /*-->*/ /*-->*/ /*-->*/ User Guide Home,https://accounting.ucr.edu/equipment/equipment-amsguide_home
404 - Content Not Found,"We're Sorry, The requested object or URL could not be found. The link you followed is either outdated, inaccurate, or has been removed. Please visit the homepage to get back on track.",https://budget.ucr.edu/bac.html
The Market at Glen Mor,"Find grocery offerings, homestyle meals-to-go, fresh grill items, and your favorite Starbucks coffee.",https://dining.ucr.edu/campus-dining/market-at-glen-mor
The Barn,"Dining at the Barn is open to all students, faculty, and staff and is made up of three buildings, an outdoor stage, and two large patio areas.",https://dining.ucr.edu/campus-dining/the-barn
404 - Content Not Found,"We're Sorry, The requested object or URL could not be found. The link you followed is either outdated, inaccurate, or has been removed. Please visit the homepage to get back on track.",https://research.ucr.edu/spa/lifecycle/pre-award-administration.aspx
Dining Services,Delicious | Nutritious | Sustainable,https://dining.ucr.edu/retail/scottys-convenience-stores/scottys-to-go
Connexxus,  What is Connexxus?,https://accounting.ucr.edu/travel-entertainment/connexxus
Payments for Independent Personal Services (Honoraria),Return to Nonresident Aliens Home »,https://accounting.ucr.edu/payroll-coordination/nonresident-aliens-home/payments-independent-personal-services-honoraria
Police & Campus Safety,"Health, Well-Being & Safety",https://police.ucr.edu/document/ucpd-policy-1
Police & Campus Safety,"Health, Well-Being & Safety",https://police.ucr.edu/document/ucrpd-safety-resource-guide-0
Police & Campus Safety,"Health, Well-Being & Safety",https://police.ucr.edu/document/sex-offender-registration-requirements
Police & Campus Safety,"Health, Well-Being & Safety",https://police.ucr.edu/document/clery-2020-annual-security-and-fire-safety-report
Police & Campus Safety,"Health, Well-Being & Safety",https://police.ucr.edu/document/ucr-pd-org-chart
404 - Content Not Found,"We're Sorry, The requested object or URL could not be found. The link you followed is either outdated, inaccurate, or has been removed. Please visit the homepage to get back on track.",https://accounting.ucr.edu/docs/accounts_payable/petcas.xls
"Codes, Standards & Policies","Design Categories California Building Code, Volume 1 of Part 2 California Building Code, Volume 2 of Part 2",https://pdc.ucr.edu/inspection-quality-assurance-compliance-division/codes-standards-policies
Human Resources,Helping employees maximize their potential,https://hr.ucr.edu/
Personnel Policies & Local Procedures,Policies and Procedures,https://hr.ucr.edu/personnel-policies-local-procedures
Human Resources Benefits,"Be sure to visit our Benefits pages to learn about the benefits the University provides, depending on your type of appointment.",https://hr.ucr.edu/human-resources-benefits
Benefits and Assessments,Return to Payroll Coordination Home » Archive Maximum Hours,https://accounting.ucr.edu/payroll-coordination/benefits-and-assessments
Emergency Notification System,The Emergen,https://emergency.ucr.edu/ENS
Human Resources,Helping employees maximize their potential,https://hr.ucr.edu/document/ppsm-81-ucr-local-procedure-reasonable-accommodation
Human Resources,Helping employees maximize their potential,https://hr.ucr.edu/document/policy-procedureppsm2210local-maxvacaccrualform
Human Resources,Helping employees maximize their potential,https://hr.ucr.edu/document/policy-procedureppsm2210local-max-vac-accrual
Human Resources,Helping employees maximize their potential,https://hr.ucr.edu/document/policy-procedureppsm2210localrequestexceedmaxvacaccrualjobaidee
UCR Emergency Notification System: Mobile Phone Number Verification,Every year on September 1,https://its.ucr.edu/ENS-Update
Compensation,"Compensation The Academic Personnel Office develops, implements, and oversees academic compensation policies and procedures. This page contains information regarding salary scales, salary programs, faculty administrator compensation, summer salary guidelines, and additional resources to assist you with finding information regarding academic compensation.",https://academicpersonnel.ucr.edu/compensation
Human Resources,Helping employees maximize their potential,https://hr.ucr.edu/document/policy-procedureppsm2210localrequestexceedmaxvacaccrualjobaid
Human Resources,Helping employees maximize their potential,https://hr.ucr.edu/document/policy-procedureppsm2210local-benefits-billing-return-leave
Human Resources,Helping employees maximize their potential,https://hr.ucr.edu/document/leave-absence-formreturn-leave-health-benefits-reinstatement-form
Employee-Initiated Reduction In Time (ERIT) Program Employee Review,Re: Employee-Initiated Reduction In Time (ERIT) Prog,https://hr.ucr.edu/hr-announcement-news/2023/04/19/employee-initiated-reduction-time-erit-program-employee-review
Update – UCR Vaccination Policy,Please Note,https://hr.ucr.edu/hr-announcement-news/2021/09/13/update-ucr-vaccination-policy
Senior Leadership Development Assessments,"Senior Leadership Development Assessments Every five years, each Senior Management Group (SMG) member participates in a leadership development assessment (or five-year review). This formative review process is designed to provide broader feedback than is usual with an annual performance evaluation, including assessment of administrative effectiveness, identification of accomplishments and challenges, and evaluation of progress toward campus and unit goals. All campus stakeholders are invited to provide feedback.",https://chancellor.ucr.edu/senior-leadership-development-assessments
Leave Accrual,"updated 2/12/2013  LEAVE ACCRUAL RECORDS Vacation and sick leaves are accrued based on the leave accrual codes established on the Payroll Personnel System (PPS). Leave code is established by the department when an appointment is initially set up. For staff employees thereafter, the PPS will re-derive the leave code on the appointment during month-begin periodic maintenance. The PPS does not re-derive the leave codes for Academic employees.",https://accounting.ucr.edu/payroll-coordination/leave-accrual
COVID Screening Check,"COVID Screening Check UC Riverside students, employees, and visitors are required to fill out the COVID Screening Check to report: ",https://campusreturn.ucr.edu/covid-screening-check
Human Resources,Helping employees maximize their potential,https://hr.ucr.edu/document/five-year-senior-leadership-development-assessment-smg-administrative-guidelines
Chancellor's Office Searches,"Chancellor's Office Executive Searches UCR's Executive Searches are conducted by the Administrative Services and Strategic Executive Team (ASSET). ASSET is the gateway to attracting top performing candidates to UC Riverside's senior management positions, including the Senior Management Group and other officers reporting directly to the Chancellor. We seek distinguished and innovative individuals to support and sustain UCR's strategic goals and mission.",https://provost.ucr.edu/chancellors-office-searches
UCR Vaccination Policy,"As announced last week, the UC Office of the Preside",https://hr.ucr.edu/hr-announcement-news/2021/07/27/ucr-vaccination-policy
Equipment Loans,"Equipment Loans University Loan Policy Contract and Grant equipment which is in the care and custody of the University, but for which the University does not have title, cannot be loaned without the specific written approval of the titleholder. University equipment cannot be loaned to any outside individuals, agencies or organizations unless t",https://accounting.ucr.edu/equipment/loans
Human Resources,Helping employees maximize their potential,https://hr.ucr.edu/
Self Supporting Operations - Closing Motives,"SELF SUPPORTING OPERATIONS Fiscal Year Closing - What's It All About? What is Fiscal Year Closing (at the departmental level)? Fiscal year closing is the process of closing the financial records for the year, so we can take a reading on financial condition (profit, loss, etc.) at one standard point in time (fiscal year end).    What are the main objectives of Fiscal Year Closing at the departmental level?",https://accounting.ucr.edu/general-accounting/self-supporting-motives
404 - Content Not Found,"We're Sorry, The requested object or URL could not be found. The link you followed is either outdated, inaccurate, or has been removed. Please visit the homepage to get back on track.",https://research.ucr.edu/spa/lifecycle/proposal-preparation-submission/proposing-cost-sharing.aspx
Non Payroll Federal Expenditure Cost Transfer Guidelines,INTERNAL CONTROL GUIDELINES FOR COST TRANSFER,https://accounting.ucr.edu/extramural-funds/npr
Establishing a New Gift Fund,"Send e-mail to emf@ucr.edu. The subject line should state ""Request for New Gift Fund"". Briefly describe the purpose/use of the gift funds. What was the donor's intent for the funds? Identify whether the gifts will be given directly to the Regents or flowing through the UCR Foundation Office. a. Identify the primary source of donors (such as individuals, for-profit businesses, non-profit business related, charitable trusts, other charitable organizations, higher education/institution/association)?",https://accounting.ucr.edu/extramural-funds/gift-funds
"File a Report of Harassment, Discrimination, Sexual Violence or other Prohibited Conduct",Online reporting portal for people to file a report or complaint about themselves or someone else.,https://titleix.ucr.edu/reporting
Discrimination and Harassment Complaint Resolution,"Flowcharts These flowcharts show the process Title IX/EOAA uses to review and respond to reports and complaints of discrimination, harassment, or retaliation under UCR Policy 650-75.  Please note that there are separate processes (and flowcharts) for reports of sexual harassment (including sexual violence).  ",https://compliance.ucr.edu/discrimination-and-harassment-complaint-resolution-0
Contact Us,  Contacts and Location Office: Skye Hall 365 Phone: (951) 827-7070 Email: titleix@ucr.edu Our mailing address is:,https://titleix.ucr.edu/contact-us
Archived Policies and Adjudication Frameworks,Prevision versions of UC SVSH Policies and Procedures (Investigation and Adjudication Frameworks),https://titleix.ucr.edu/archived-policies-and-adjudication-frameworks
Pregnancy,Information and resources about Pregnancy at UCR,https://compliance.ucr.edu/pregnancy
Rights & Options for Students,"Rights & Options Letter for Students Reported to Have Experienced Sexual Violence or Sexual Harassment If you are a student who has experienced sexual violence or sexual harassment, or other conduct prohibited by the UC Sexual Violence and Sexual Harassment Policy, the",https://titleix.ucr.edu/rights-options-students
404 - Content Not Found,"We're Sorry, The requested object or URL could not be found. The link you followed is either outdated, inaccurate, or has been removed. Please visit the homepage to get back on track.",https://fomucpath.ucr.edu/salarycosttransfer_infographic_new.pdf%2520
Compliance,Integrity and Accountability,https://compliance.ucr.edu/document/retaliation-faqs
COVID Screening Survey,Qualtrics sophisticated online survey software solutions make creating online surveys easy. Learn more about Research Suite and get a free account today.,https://ucriverside.az1.qualtrics.com/jfe/form/SV_0pOB27zdrdkYxzE
Rights and Options for Employees,"Rights & Options Letter for Employees Reported to Have Experienced Sexual Violence or Sexual Harassment If you are an employee who has experienced sexual violence or sexual harassment, or other conduct prohibited by the UC Sexual Violence and Sexual Harassment Policy, the Rights and Options Letter is a one-page collection of important resources",https://titleix.ucr.edu/rights-and-options-employees
F&A Cost Rates,"Implementation of New Facilities and Administrative (F&A) Rates - Effective April 1, 2015",https://research.ucr.edu/spa/lifecycle/proposalpreparation/rates
Support Sites & Feedback,Support Sites & Feedback Please refer to the following support sites for documentation relating to the various campus systems. Problems encountered while using each systems can be reported to the feedback emails noted below.,https://bfs.ucr.edu/support-sites-feedback
Payroll Coordination & Analysis,Icons made by Freepik from www.flaticon.com is licensed by CC 3.0 BY,https://accounting.ucr.edu/payroll-coordination
COMPLIANCE TEST OF USE OF FEDERAL FUNDS,"REF: FINANCIAL ANALYSIS OFFICE All charges to Federal awards must meet the tests of reasonableness, allowability and allocability in accordance with the provision of OMB Circular A-21 and the terms and conditions of the grant or other agreement. The draft Department of Health and Human Services ""Guidelines for Audits of Federal Awards to Educational Institutions"" details the following determinations to assist the non-Federal auditor in testing specific charges:",https://accounting.ucr.edu/extramural-funds/compliance
CLOSEOUT OF AWARDS,REF: FEDERAL REGISTER OMB A-110,https://accounting.ucr.edu/extramural-funds/closeout
Fund Ranges for Contracts & Grants,State Agencies 18200 – 18999 20400 – 20499 20600 – 20699 80000 – 80999 Local Government 20700 – 20999 81000 – 81999 Federal Agencies,https://accounting.ucr.edu/extramural-funds/cg-fund-ranges
Cost Sharing and Matching,"Cost sharing and matching represent the portion of the project costs which are not borne by the federal sponsoring agency. Cost Sharing Defined Cost sharing represents a contribution of non-federal university funds that are applied to any allowable costs of the project. The university-funded salaries of faculty and other employees directly engaged in the project, together with related employee benefits and indirect costs, constitute the most appropriate contribution to federal research projects. Matching Defined",https://accounting.ucr.edu/extramural-funds/cost-sharing
UC Sexual Harassment and Sexual Violence Policies and Procedures,"On this webpage, you can find the UC SVSH Policy and the procedures used to enforce the policy, which are called Investigation and Adjudication Frameworks.  Please use the pull-down menu above to access the document you are interested in.  For other non-discrimination and affirmative action policies, please visit here.",https://titleix.ucr.edu/uc-sexual-harassment-and-sexual-violence-policies-and-procedures
Policies,"Policies and procedures are foundational at UCR.  Policies show us what type of place UCR is–how we are to treat one another, and how we can expect to be treated.  Policies and procedures show us how we are expected to do certain aspects of our jobs, and how we conduct ourselves when representing the university.",https://compliance.ucr.edu/policies
404 - Content Not Found,"We're Sorry, The requested object or URL could not be found. The link you followed is either outdated, inaccurate, or has been removed. Please visit the homepage to get back on track.",https://research.ucr.edu/about/policies-ucr.aspx
Compliance,Integrity and Accountability,https://compliance.ucr.edu/document/bus-43-final-draft-tracked-changes
404 - Content Not Found,"We're Sorry, The requested object or URL could not be found. The link you followed is either outdated, inaccurate, or has been removed. Please visit the homepage to get back on track.",https://research.ucr.edu/spa/clinical-trials/budget.aspx
Office of Campus Veterinarian,"The UC Riverside Office of Campus Veterinarian (OCV) oversees all animal facilities at the University of California, Riverside (UCR).  The laboratory animal care and use program at UC Riverside complies with feder",https://research.ucr.edu/ocv
Office of Legal Affairs,Fostering Client Success,https://legalaffairs.ucr.edu/
Research Development,Research Related Links Pivot - Pivot answers the growing demands on research developers to quickly discover the right funding opportunities and effectively collaborate with their,https://research.ucr.edu/ord
Human Resources,Helping employees maximize their potential,https://hr.ucr.edu/
Office of Research Integrity,"About ORI We are transitioning to Kuali's online applications to help streamline the management of research protocols. For details and training resources, visit UCR's Kuali Research Page.",https://research.ucr.edu/ori
Sponsored Programs,About SPA Sponsored Programs Administration (SPA) supports and advises campus researchers and their staff with a variety of extramural endeavors and funding transactions.,https://research.ucr.edu/spa
Compliance,Integrity and Accountability,https://compliance.ucr.edu/document/bus-43-final-draft-clean-copy
Compliance,Integrity and Accountability,https://compliance.ucr.edu/document/bus-43-presidential-policy-systemwide-review-cover-letter
Campus and Workplace COVID Update,"Dear Members of the UCR Campus Community, This week, the California Division of Occupational Safety and Health (Cal/OSHA) issued its latest guidance on workplace requirements for workplace safety. As of today, at UCR:",https://insideucr.ucr.edu/announcements/2021/06/23/campus-and-workplace-covid-update
404 - Content Not Found,"We're Sorry, The requested object or URL could not be found. The link you followed is either outdated, inaccurate, or has been removed. Please visit the homepage to get back on track.",https://counseling.ucr.edu/emergency-assistance/respondingdistressedstudents.html
Whistleblower and Whistleblower Protection - Local Procedures,The campus procedures implementing the University of California Whistleblower Policy and Whistleblower Protection Policy.  ,https://compliance.ucr.edu/whistleblower-and-whistleblower-protection-local-procedures
IBC,Institutional Biosafety Committee (IBC),https://ehs.ucr.edu/ibc
Critical Student Incident Team,The Critical Student Incident Team provides action and support to address the needs of students who are distressed while assuring a safe and secure campus for the entire UCR community. Learn more.,https://deanofstudents.ucr.edu/emergency-crisis-help/critical-student-incident-team
Counseling & Psychological Services Videos,Counseling & Psychological Services videos,https://counseling.ucr.edu/counseling-psychological-services-videos
