Ecopipam reduces stuttering symptoms in proof-of-concept trial,UC Riverside-led open-label pilot study leads to a double-blind clinical trial to further test ecopipam’s efficacy and safety in adult patients who stutter,https://news.ucr.edu/articles/2019/08/28/ecopipam-reduces-stuttering-symptoms-proof-concept-trial
Developing a COVID-19 vaccine at warp speed,"Dr. Paul Offit, an international expert on vaccines, will give the 2020 Thomas and Salma Haider Biomedical Breakthrough Lecture at UC Riverside",https://news.ucr.edu/articles/2020/09/28/developing-covid-19-vaccine-warp-speed
Star-shaped brain cells may be linked to stuttering,UC Riverside-led study examined the effects of the medication risperidone on brain metabolism in stuttering,https://news.ucr.edu/articles/2021/02/11/star-shaped-brain-cells-may-be-linked-stuttering
School of Medicine to serve as lead site for clinical trial on stuttering,Phase 2 study investigates efficacy of the drug ecopipam developed by Emalex Biosciences Inc.,https://news.ucr.edu/articles/2020/12/15/school-medicine-serve-lead-site-clinical-trial-stuttering
School of Medicine signs agreement with AIDS Healthcare Foundation,Partnership provides opportunities for UCR medical students to train at a Riverside clinic focused on AIDS treatment,https://news.ucr.edu/articles/2018/09/28/school-medicine-signs-agreement-aids-healthcare-foundation
Steering into the future of connected and automated vehicles,"More than 1 billion motor vehicles travel roadways worldwide and that number is expected to double within one or two decades.  The rise in automobiles and trucks have led to increased social, economic, and safety issues, such as the more than 30,000 deaths from car related accidents on US highways every year, according to a US Department of Transportation (DOT)",https://news.ucr.edu/articles/2019/07/10/steering-future-connected-and-automated-vehicles
Inland Empire outpacing California in business establishment growth,Region has more than offset establishment losses from the ‘Great Recession’,https://news.ucr.edu/articles/2019/06/11/inland-empire-outpacing-california-business-establishment-growth
Experts on stroke,"  For fast access to experts, TEXT or call the 24-hour-experts hotline at 951-312-3049, or email news@ucr.edu  Stroke   Byron Ford: Professor of biomedical sciences. Developing neuregulin-1 (NRG1) as a treatment in clinical trials for stroke; neuroscience; cellular and molecular mechanisms involved in the pathophysiology of stroke and acute brain injuries. byron.ford@ucr.edu   Lama Al-Khoury: Associate clinical professor. Stroke; stroke prevention; headaches; neurology. lama.al-khoury@ucr.edu",https://news.ucr.edu/articles/2019/06/11/experts-stroke
Ramadan in the time of COVID-19,"The pandemic has forced smaller gatherings, but students have still found an opportunity for reflection and family time.",https://news.ucr.edu/articles/2021/05/08/ramadan-time-covid-19
Experts on the Salton Sea,"  For fast access to experts, TEXT or call the 24-hour-experts hotline at 951-312-3049, or email news@ucr.edu  Salton Sea Emma Aronson: Associate professor of microbiology and plant pathology. Microbiome of the Salton Sea; microbial ecology of dust; wind- transported microorganisms; environmental microbiology; soil microbial ecology. emma.aronson@ucr.edu",https://news.ucr.edu/articles/2019/10/10/experts-salton-sea
Students' summer impact,"Summer break does not translate into idle hours for these three UC Riverside students.  For Bela Mendoza, a three-month summer internship with Riverside’s Operation SafeHouse, a youth emergency shelter, has given her an inside look at how to make a bigger — and more positive — impact in the lives of teens facing issues such as foster care, depression, homelessness, and human trafficking. At one point, she too experienced foster care and homelessness.",https://news.ucr.edu/articles/2019/08/28/students-summer-impact
Public lecture to focus on synthetic genome engineering,Lei Stanley Qi of Stanford University will give the 2021 Thomas and Salma Haider Biomedical Breakthrough Lecture at UC Riverside,https://news.ucr.edu/articles/2021/09/21/public-lecture-focus-synthetic-genome-engineering
Taking photos of slides helps students remember,"Students often take camera-phone photos of slides during an instructor’s presentation. But the question has lingered whether this practice helps students remember information. A first-of-its-kind study answers the question, finding that taking pictures of PowerPoint slides during an online presentation helped students remember the slide content better than for slides they did not photograph. The study was recently published in the Journal of Applied Research in Memory and Cognition by UC Riverside psychology professor and researcher Annie Ditta.",https://news.ucr.edu/articles/2022/10/17/taking-photos-slides-helps-students-remember
UCR School of Medicine and Eisenhower Health establish training affiliation,Partnership addresses long-term healthcare needs of Coachella Valley,https://news.ucr.edu/articles/2018/12/04/ucr-school-medicine-and-eisenhower-health-establish-training-affiliation
Proteins enable crop-infecting fungi to ‘smell’ food,New UC Riverside research shows the same proteins that enable human senses such as smell also allow certain fungi to sense something they can eat. The study offers new avenues for protecting people from starvation due to pathogenic fungus-induced food shortages. Understanding how fungi sense and digest plants can also help scientists engineer fungal strains that are more efficient at producing biofuels.,https://news.ucr.edu/articles/2020/12/15/proteins-enable-crop-infecting-fungi-smell-food
Wildfire dataset could help firefighters save lives and property,WildfireDB contains over 17 million data points that capture how fires have spread in the contiguous United States over the last decade,https://news.ucr.edu/articles/2021/12/08/wildfire-dataset-could-help-firefighters-save-lives-and-property
Beyond Brilliant: Alfonso Maldonado '13,"Heading north from Riverside, Alfonso Maldonado '13 often makes the more-than-50-mile drive to the Adelanto U.S. Immigration and Customs Enforcement Processing Center in the Mojave Desert. There he meets with clients; most, newly arrived immigrants to the United States seeking asylum while their cases maneuver the legal system. Maldonado represents roughly 20 clients at any one time. “My very first trip to Adelanto I was terrified,” said Maldonado, 30. ",https://news.ucr.edu/articles/2019/10/11/beyond-brilliant-alfonso-maldonado-13
Experts on wildfires,"  For fast access to experts, TEXT or call the 24-hour-experts hotline at 951-312-3049, or email news@ucr.edu ",https://news.ucr.edu/articles/2019/10/11/experts-wildfires
Extension offers first-of-its-kind ethnic studies certificate program,University Extension is the first continuing education program in California to offer teachers a professional development certificate for a newly state-mandated course.,https://news.ucr.edu/articles/2021/10/26/extension-offers-first-its-kind-ethnic-studies-certificate-program
Brain injury research to focus on moderate concussion,"Viji Santhakumar, an associate professor of molecular, cell and systems biology at the University of California, Riverside, has received funding from the National Institute of Neurological Disaster and Stroke of the National Institutes of Health to further pursue research on moderate concussive brain injury, which results from car accidents or sports-related concussions.",https://news.ucr.edu/articles/2021/05/27/brain-injury-research-focus-moderate-concussion
Beyond Brilliant: Regina Louise,"Regina Louise has never known a “normal” childhood. Throughout her tumultuous youth, she was shuffled through over 30 foster homes and psychiatric facilities, all before the age of 18.  Subjected to neglect, abuse, overmedication, and solitary confinement while in foster care, Louise’s trauma was compounded by a racially motivated ruling, which prevented her counselor, Jeanne Kerr, from adopting her in 1974 on the basis that Kerr was white and Louise was black.",https://news.ucr.edu/articles/2019/10/11/beyond-brilliant-regina-louise
"Graphic Novelist John Jennings reflects on relevance of X-Men story ‘God Loves, Man Kills’ in an essay for Marvel","In an essay for Marvel, John Jennings, a professor of media and cultural studies, reflects on the 1982 graphic novel “X-Men: God Loves, Man Kills” by Chris Claremont and Brent Anderson, which is being re-released this year in a two-part extended cut.",https://news.ucr.edu/articles/2020/07/15/graphic-novelist-john-jennings-reflects-relevance-x-men-story-god-loves-man
Graphic Novel Adaptation of “Kindred” Nominated for Eisner Award,John Jennings discusses the challenge of transforming the beloved classic into a best-selling graphic novel.,https://news.ucr.edu/articles/2018/07/17/graphic-novel-adaptation-kindred-nominated-eisner-award
How stressed-out plants produce their own aspirin ,"Plants protect themselves from environmental hazards by producing salicylic acid, also known as aspirin. A new understanding of this process may help plants survive climate change.",https://news.ucr.edu/articles/2022/07/12/how-stressed-out-plants-produce-their-own-aspirin
Connecting Classrooms to Congress,New social studies curriculum aims to boost civic education in a polarized nation,https://news.ucr.edu/articles/2021/07/27/connecting-classrooms-congress
A different type of holiday party for Guardian Scholars,"The program works to make the holidays special for foster youth, despite the pandemic’s challenges.",https://news.ucr.edu/articles/2020/12/16/different-type-holiday-party-guardian-scholars
So cute you could crush it?,A UC Riverside professor’s first-of-its-kind study explores the neural underpinnings of cute aggression,https://news.ucr.edu/articles/2018/12/04/so-cute-you-could-crush-it
Out of the ashes and into the fire,"‘Facing Fire’ explores the beauty, threat, and devastation of California’s growing wildfires",https://news.ucr.edu/articles/2020/02/19/out-ashes-and-fire
"Black stories, culture, and Hollywood","In this Q&A UCR experts discuss culture, history, and the importance of Black films.",https://news.ucr.edu/articles/2023/01/23/black-stories-culture-and-hollywood
Grant to physicist gives study of strongly interacting systems a boost,"A physicist at the University of California, Riverside, has received a grant of about $523,000 from the U.S. Department of Energy to study the possible emergent behavior of “strongly interacting systems,” an important area of focus in solid-state physics.  Specifically, when the repulsive Coulomb force between electrons in a solid becomes strong, new behaviors — not easily understood from knowledge of the microscopic laws of nature — are possible. ",https://news.ucr.edu/articles/2019/07/30/grant-physicist-gives-study-strongly-interacting-systems-boost
Two School of Medicine faculty elected to National Academy of Medicine,Deborah Deas and Mario Sims are recognized for their contributions to advancing public health,https://news.ucr.edu/articles/2022/10/17/two-school-medicine-faculty-elected-national-academy-medicine
Economic Crisis Response Team ensures students receive food and shelter,The interdepartmental group has received dozens of requests for support since campus closure.,https://news.ucr.edu/articles/2020/04/01/economic-crisis-response-team-ensures-students-receive-food-and-shelter
How are epilepsy and autism linked?,UC Riverside and Rutgers University scientists explore this question in a study on mice,https://news.ucr.edu/articles/2021/11/08/how-are-epilepsy-and-autism-linked
UC Riverside partners with City of Riverside on Eastside revitalization project,"CE-CERT will track greenhouse gas reductions, indicators of public health, and economic impacts from the $31 million dollar project",https://news.ucr.edu/articles/2020/07/15/uc-riverside-partners-city-riverside-eastside-revitalization-project
Study shows how memory function could be preserved after brain injury,UC Riverside-led study identifies role played by an immune signaling molecule in regulating memory function in the normal and injured brain,https://news.ucr.edu/articles/2020/05/12/study-shows-how-memory-function-could-be-preserved-after-brain-injury
Early intervention following traumatic brain injury reduces epilepsy risk,UC Riverside-led rat study finds an immune receptor in the hippocampus is responsible for the onset of the disease after brain injuries,https://news.ucr.edu/articles/2020/02/27/early-intervention-following-traumatic-brain-injury-reduces-epilepsy-risk
"22 Southern California newspapers will be preserved, digitized, and available to the public",A John Randolph Haynes and Dora Haynes Foundation grant will help preserve 150 years of local journalism at UC Riverside.,https://news.ucr.edu/articles/2022/10/17/22-southern-california-newspapers-will-be-preserved-digitized-and-available
UCR researcher addresses incentive disparities in HIV research,"To encourage subjects to participate in clinical and behavioral HIV studies, researchers often offer incentives such as cash or gift cards. But such remuneration could distort the sampling and end up inadvertently hurting the research findings. Lured by the incentives, participants could easily conceal information about themselves to qualify. Or they could give false information about themselves in order to stay in the study.",https://news.ucr.edu/articles/2018/07/17/ucr-researcher-addresses-incentive-disparities-hiv-research
ECS teacher Mamie White-Carter – ‘community treasure’- retires after 20 years,"UCR faculty and staff recall the kindergarten teacher who stood up for education, and stood out for a generation of parents",https://news.ucr.edu/articles/2018/06/27/ecs-teacher-mamie-white-carter-community-treasure-retires-after-20-years
The future of the town hall is online,Kevin Esterling’s advice to tech companies? Listen to — and learn from — political scientists,https://news.ucr.edu/articles/2018/10/01/future-town-hall-online
Root bacteria could help defeat fatal citrus disease,"A UC Riverside-led team is looking at tiny underground microorganisms for a way to prevent a huge problem — Huanglongbing, a disease with no cure that has decimated citrus orchards worldwide. The National Institute of Food and Agriculture has awarded the team $10 million to investigate the role of soil and root microbes in the disease.  ",https://news.ucr.edu/articles/2020/12/16/root-bacteria-could-help-defeat-fatal-citrus-disease
"Dining, library, student services reopenings announced","For 18 months, the most consistent signs of life at the UC Riverside campus have involved spitting nocturnal sprinklers. That’s about to change. The campus is preparing for a full return in fall quarter, for which classes begin on Sept. 23. Long-shuttered dining halls and coffee joints are opening, along with essential student services.",https://news.ucr.edu/articles/2021/09/01/dining-library-student-services-reopenings-announced
KD Ganaway exhibition coming to the California Museum of Photography,"UCR’s California Museum of Photography will showcase the work of King Daniel (KD) Ganaway, one of the earliest Black photographers in the U.S. The exhibition runs Feb. 25 - Aug. 6.",https://news.ucr.edu/articles/2023/02/21/kd-ganaway-exhibition-coming-california-museum-photography
Exhibition explores 20th Century through the lens of dust,"A peculiar photograph leads to an examination of modernity, war, and ruin in “A Handful of Dust”",https://news.ucr.edu/articles/2018/06/11/exhibition-explores-20th-century-through-lens-dust
‘Little Free Pantry’ now available to student parents at Oban Family Housing,"Students with families living at UC Riverside's Oban Family Housing now have access to a small pantry at any time of the day.  Small hand sanitizers, canned veggies, coffee, and other nonperishable food items sit inside the Little Free Pantry, a roughly 2-foot-by-1.5-foot wooden miniature shed-shaped case inspired by the Little Free Library stands that hold free books for the community. At Oban Family Housing the Little Free Pantry hangs on a wall inside the laundry room, which grants residents access 24/7. ",https://news.ucr.edu/articles/2021/03/17/little-free-pantry-now-available-student-parents-oban-family-housing
UCR Arts exhibition examines architecture and painting,“Painting Architecture” will open at the Barbara and Art Culver Center of the Arts on Sept. 1,https://news.ucr.edu/articles/2018/08/28/ucr-arts-exhibition-examines-architecture-and-painting
Deconstructing the indestructible ‘Luke Cage’,"“How do you show that he’s bulletproof?” asks artist and University of California, Riverside professor John Jennings, while discussing Marvel superhero Luke Cage. “You have to shoot him. You have to have a black man during the Black Lives Matter movement shot every episode to prove that he’s bulletproof. And that’s problematic.”",https://news.ucr.edu/articles/2018/11/15/deconstructing-indestructible-luke-cage
"Hip-hop diaspora: Life, culture and academia",When,https://news.ucr.edu/articles/2018/11/27/hip-hop-diaspora-life-culture-and-academia
UCR celebrates 25 years of dance and scholarship,"A Feb. 9 event commemorates the Department of Dance’s critical dance studies program. The day-long celebration will feature performances, talks, and roundtable discussions.",https://news.ucr.edu/articles/2019/01/18/ucr-celebrates-25-years-dance-and-scholarship
Finding grace through waste in ‘Intolerable Beauty’,The new exhibition from artist and environmental activist Chris Jordan runs July 6-Jan. 5 at the Culver Center of the Arts,https://news.ucr.edu/articles/2019/06/17/finding-grace-through-waste-intolerable-beauty
The enduring power of art as activism in “Emory Douglas: Bold Visual Language”,"Although the Black Panther Party dissolved nearly 40 years ago, the movement’s legacy endures — largely through the iconic imagery created by former party member Emory Douglas. ",https://news.ucr.edu/articles/2019/05/06/enduring-power-art-activism-emory-douglas-bold-visual-language
“Fictive Kin” questions how we view the everyday,"A new exhibition showcasing the photography of contemporary artists Sarah Conaway, Annette Kelm, and Kim Schoen will debut at the Culver Center of the Arts at UCR ARTSblock on Feb. 24. Much information in our daily lives is consumed through visual cues, like billboards blinking by on a highway, with little time to question authenticity. “Fictive Kin” invites viewers to consider the often-unconscious assumptions we make when looking at photos.",https://news.ucr.edu/articles/2018/02/21/fictive-kin-questions-how-we-view-everyday
In the eye of the beholder,A new exhibition at the California Museum of Photography explores the iconic work of documentary photographer Bruce Davidson and the evolution of meaning in photographs,https://news.ucr.edu/articles/2020/10/19/eye-beholder
‘Art in the Plague Year’ exhibition seeks art imagining a world beyond 2020,The open call marks the first time the California Museum of Photography has solicited art from the public at this scale,https://news.ucr.edu/articles/2020/11/24/art-plague-year-exhibition-seeks-art-imagining-world-beyond-2020
"Decoding race, monstrosity, and desire in ‘Candyman’","“Reflection Eternal,” on view at the Culver Center of the Arts Aug. 31-Jan. 19, unpacks the iconic horror film figure",https://news.ucr.edu/articles/2019/08/28/decoding-race-monstrosity-and-desire-candyman
Grant will cover childcare costs for student parents at UCR,"The University of California, Riverside’s Early Childhood Services center received a four-year grant from the United States Department of Education to provide low income undergraduate students with childcare assistance. The reauthorized $1.4 million grant will give these student parents a financial breather while they balance parenting and college life. Funding comes from the U.S. Department of Education’s Child Care Access Means Parents in School Program, or CCAMPIS, which came into effect on Oct. 1. In 2014 the center received a similar grant amount from CCAMPIS.  ",https://news.ucr.edu/articles/2018/11/06/grant-will-cover-childcare-costs-student-parents-ucr
Skateboarder’s view: Photo exhibit captures an inside look at California’s skate parks,"A photo exhibit and book launch are set for Sept. 19 in Orange County, with the show traveling to UCR’s Culver Center of the Arts in January 2020.",https://news.ucr.edu/articles/2019/09/06/skateboarders-view-photo-exhibit-captures-inside-look-californias-skate-parks
UCR ARTS goes virtual,"Experience 360-degree exhibition tours, artist interviews, hands-on activities, and more from the comfort of home",https://news.ucr.edu/articles/2020/05/22/ucr-arts-goes-virtual
UCR Arts receives American Alliance of Museums accreditation,AAM is the fields’ gold standard for museum excellence.,https://news.ucr.edu/articles/2022/03/07/ucr-arts-receives-american-alliance-museums-accreditation
UCR ARTS reopens May 13 — now with free admission,Explore six exhibitions at the California Museum of Photography and Culver Center of the Arts with new measures ensuring guest safety,https://news.ucr.edu/articles/2021/05/03/ucr-arts-reopens-may-13-now-free-admission
‘Empty Vessel’ offers a rare insider’s view of California skate parks,Photographer Amir Zaki highlights the unique architectural spaces and their place in California culture,https://news.ucr.edu/articles/2020/02/14/empty-vessel-offers-rare-insiders-view-california-skate-parks
Silver linings playbook: Think bad news before it's delivered,"Psychologists have known there’s value in finding a “silver lining,” in coaxing oneself through bad news. You didn’t get the job? Just as well: That new boss seemed edgy during the interview. Someone outbid you at the last second for that antique something-or-other on eBay? You didn’t really have the money to spend anyway. Those coping strategies result in less depression, and greater life satisfaction and self-esteem. Finding silver linings can even mean better physical health.",https://news.ucr.edu/articles/2021/09/01/silver-linings-playbook-think-bad-news-its-delivered
Grant will help engineer human-like nerve tissue,The tissue will be used to study neurological diseases,https://news.ucr.edu/articles/2018/11/27/grant-will-help-engineer-human-nerve-tissue
Tropical trees use unique method to resist drought,"UCR research may alleviate concerns about impact of drought on Amazonian trees, which play a critical role in regulating the global climate",https://news.ucr.edu/articles/2018/02/21/tropical-trees-use-unique-method-resist-drought
UCR mechanical engineering professor receives award to quantify roadside pollutants,"Near-road air quality continues to be an important issue for transportation agencies. Invisible plumes of dirty air from cars and trucks on roadways spread to surrounding neighborhoods increasing residents’ risk of cancer, asthma, heart disease, and other illnesses.",https://news.ucr.edu/articles/2019/06/17/ucr-mechanical-engineering-professor-receives-award-quantify-roadside
UCR ARTS awarded National Endowment for the Arts grant,"The grant will support “Christina Fernandez: Multiple Exposures,” an exhibition opening in fall 2022.",https://news.ucr.edu/articles/2022/01/11/ucr-arts-awarded-national-endowment-arts-grant
Looming insect invasion threatens California wine and avocados,"UC Riverside is testing whether a sesame seed-sized wasp can control a pest that could seriously damage California crops including wine, walnuts, and avocados. ",https://news.ucr.edu/articles/2019/06/17/looming-insect-invasion-threatens-california-wine-and-avocados
Gender insecurity prompts women MMA fighters to date hypermasculine men,Challenging gender norms in sport can lead to overdoing them in intimate relationships,https://news.ucr.edu/articles/2020/10/19/gender-insecurity-prompts-women-mma-fighters-date-hypermasculine-men
First comprehensive fundraising campaign nears its end,"UC Riverside is closing in on the end of its first-ever comprehensive fundraising campaign. The total raised through August 23 was $298,116,805.",https://news.ucr.edu/articles/2020/08/25/first-comprehensive-fundraising-campaign-nears-its-end
Inland Empire wage growth continues in tight labor market,The regions's home affordability helps local labor force expand,https://news.ucr.edu/articles/2019/03/28/inland-empire-wage-growth-continues-tight-labor-market
Conspicuous slowdown in business activity hits Inland Empire,Region’s job growth underperforms state for first time since 2012,https://news.ucr.edu/articles/2019/05/15/conspicuous-slowdown-business-activity-hits-inland-empire
Inland Empire business activity outpacing U.S. GDP growth,Local manufacturing industry remains a key growth sector,https://news.ucr.edu/articles/2019/11/14/inland-empire-business-activity-outpacing-us-gdp-growth
Inland Empire business activity jumps following first quarter slowdown,New analysis reveals region’s most and least competitive industries,https://news.ucr.edu/articles/2019/08/08/inland-empire-business-activity-jumps-following-first-quarter-slowdown
University Extension receives federal grant to help train the local labor force,The United States Department of Labor has awarded nearly $1 million to UC Riverside’s University Extension to help train the Southern California’s labor force. ,https://news.ucr.edu/articles/2020/07/16/university-extension-receives-federal-grant-help-train-local-labor-force
