title,description,url
UCR Face Covering Policy,"UCR Face Covering Policy Effective July 29, 2021, mask wearing will be",https://hr.ucr.edu/ucr-face-covering-policy
Clarification on the COVID-19 - Paid Time Off and Use of PAL,This communication is to,https://hr.ucr.edu/hr-announcement-news/2021/03/17/clarification-covid-19-paid-time-and-use-pal
Human Resources,Helping employees maximize their potential,https://hr.ucr.edu/
Staff Assembly,"Many Talents, One Mission",https://staffassembly.ucr.edu/document/faqs-engagement-surveys
"COVID Wellness Kits, Masks, and Information",Free COVID-19 Wellness Kits ,https://well.ucr.edu/covid-wellness-kits-masks-and-information
UCRRA Scholarship,"The UCR Retirees’ Association (UCRRA) is excited to invite UCR students to apply for their UCRRA Undergraduate Student Scholarship in the amount of $5,000. Thanks to the countless contributions from retired staff of UCR, the UCRRA and its members feel honored to offer this scholarship for undergraduate students to support their education goals and success at UCR. Below you will find the scholarship criteria and deadline to apply. We ask that you kindly share this scholarship opportunity with interested students.",https://staffassembly.ucr.edu/ucrra-scholarship
Face Coverings,Face Covering Request Updated 04/04/2022 | Check Back often for updates,https://ehs.ucr.edu/coronavirus/facecoverings
404 - Content Not Found,"We're Sorry, The requested object or URL could not be found. The link you followed is either outdated, inaccurate, or has been removed. Please visit the homepage to get back on track.",https://transportation.ucr.edu/sites/default/files/2023-03/rta_upass_instructions_rev_03-10-23.pdf
Employee and Organizational Development, ,https://hr.ucr.edu/employee-and-organizational-development
UCR Staff Conference,"Tuesday, March 22 and Wednesday, March 23, 2022",https://staffassembly.ucr.edu/ucr-staff-conference
TowerTalk Newsletter,TowerTalk Newsletter The quarterly e-newsletter of the Emeriti and Retirees Associations featuring news and upcoming events. 2023 Spring 2023 Winter 2023 2022,https://emeriti-retirees.ucr.edu/towertalk-newsletter
Directions for Adding a Vehicle to a Parking Permit,"To prepare for License Plate Recognition and having your license plate be your ""permit"", you will need to register your vehicles and associate them with your current ""permit"".",https://transportation.ucr.edu/add-vehicle-to-permit
License Plate Recognition,"LPR is a system of cameras and accompanying software, which will be placed in Transportation Services vehicles to scan license plates.",https://transportation.ucr.edu/lpr
10-Pack Permit,"If you are not commuting to campus regularly, a 10-pack permit option might be the best choice for you.  A Blue 10-pack is sold for Blue lots and a Red 10-pack is sold for Red lots, based on availability. A 10-pack permit provides ten daily parking permits to use any day you want within the fiscal year.",https://transportation.ucr.edu/10-pack
Faculty/Staff Parking Permit Rates,"View the faculty and staff parking permit rates for the University of California, Riverside.",https://transportation.ucr.edu/faculty-staff-permit-rates
All UCR employees now eligible for COVID-19 vaccine,"All UC Riverside employees are now eligible to obtain a COVID-19 vaccine under Phase 1B of the State of California’s vaccine allocation guidelines, which allows for those working in the education sector to receive a vaccine. This message contains important information about employment verification and vaccine availability.",https://insideucr.ucr.edu/announcements/2021/03/03/all-ucr-employees-now-eligible-covid-19-vaccine
Human Resources,Helping employees maximize their potential,https://hr.ucr.edu/document/interim-policy-sars-cov-2-vaccination-program
New Vaccination Policy - Submit Your Vaccination Record by August 16,A new,https://hr.ucr.edu/hr-announcement-news/2021/07/16/new-vaccination-policy-submit-your-vaccination-record-august-16
Message from Chancellor Wilcox - Campus and Workplace COVID Update,"Dear Members of the UCR Campus Community,",https://hr.ucr.edu/hr-announcement-news/2021/06/23/message-chancellor-wilcox-campus-and-workplace-covid-update
Human Resources Business Partners, ,https://hr.ucr.edu/front/management-human-resources-business-partners
Human Resources,Helping employees maximize their potential,https://hr.ucr.edu/
Human Resources,Helping employees maximize their potential,https://hr.ucr.edu/
Learn About Vanpooling,UCR’s Vanpool Program matches groups of UCR commuters living within close proximity of each other and allows them to share the ride to and from the UCR campus.,https://transportation.ucr.edu/vanpool
Learn About Carpooling,"Carpooling is a great way to get to and from campus. It saves money by reducing your gasoline, car maintenance and parking costs.",https://transportation.ucr.edu/carpool
Learn About Metrolink,Metrolink serves the UCR campus with two local stations in Riverside. Metrolink provides a student discount to those with a valid Student ID.,https://transportation.ucr.edu/metrolink
Learn About Our Bike/Walk Program,"UCR supports ""Active Transportation"" and offers a Bicyclist and Walker Program designed to make these zero-emission commute modes a better choice.",https://transportation.ucr.edu/bike-walk/bike-walk-program
Human Resources,Helping employees maximize their potential,https://hr.ucr.edu/document/work-life-form-telecommuting-agreement
Information Technology Solutions,Making IT Possible,https://its.ucr.edu/
Citation Codes & Definitions,View the list of citation codes and their definitions.,https://transportation.ucr.edu/citations/citation-codes
Faculty/Staff Commute Options,Transportation Services manages many programs to promote alternatives to driving to campus alone. View our commuting and parking options for faculty and staff.,https://transportation.ucr.edu/faculty-staff-commute-options
Undergraduate Admissions and Financial Aid Quarterly Forum, ,https://connect.ucr.edu/register/form?id=d9546afd-d928-45f2-bada-92ec27025cb5
FIND RESOURCES,"These IT resources will help you learn, teach, and work at UCR.",https://its.ucr.edu/resources
FAST SSC,"FINANCE ADMINISTRATIVE SERVICES TEAM (FAST) Shared Service Center As a product of our passion for serving our clients and our constant pursuit of perfection in administrative services, we will continuously improve and deliver the client value experience for administrative support needs.  ",https://ucpath.ucr.edu/fast-ssc
Portfolio,  Quarterly and Annual Reports,https://hsifbusiness.ucr.edu/portfolio
Volunteer of the Year Award,The Volunteer of the Year Award is presented annually to an exceptional Staff Assembly volunteer. Individuals are nominated by other volunteers and Staff Assembly Executive Board members.,https://staffassembly.ucr.edu/volunteer-year-award
Mary Johnson Outstanding Retiree Award,"2021-2022 Mary Johnson Outstanding Retiree Award in partnership with Staff Assembly Each year, this award will be given to those retired staff who have demonstrated a high level of volunteer service to the campus and surrounding communities and participation in campus activities/programs while in retirement. ",https://staffassembly.ucr.edu/mary-johnson-outstanding-retiree-award
TRIO Programs,"UC Riverside’s TRIO programs help first-generation, income-qualified and other select students excel at university and beyond. Apply today.",https://trio.ucr.edu/
Where Preparation Meets Opportunity,EAOP at UC Riverside provides local high school students with college-readiness resources and support.,https://eaop.ucr.edu/
Campus Safety Task Force and Next Steps,"Dear Campus Community, For many years, we have been striving at UC Riverside to redefine campus safety in a way that addresses the needs of our diverse community. Through the Black Student Task Force (BSTF), we began important conversations across campus in 2015. Then, following the UC Presidential Task Force on University Policing 2019 recommendations and 2020 implementation reports, we began to put in place accountability and transparency measures. ",https://insideucr.ucr.edu/announcements/2021/03/22/campus-safety-task-force-and-next-steps
Clarification on Remote Work Options for Staff,"The COVID-19 situation has required continuous response and accommodation, resulting in rapid changes. As such, many campus administrators may not have had the opportunity to ensure staff were prepared to work remotely.",https://insideucr.ucr.edu/announcements/2020/03/18/clarification-remote-work-options-staff
404 - Content Not Found,"We're Sorry, The requested object or URL could not be found. The link you followed is either outdated, inaccurate, or has been removed. Please visit the homepage to get back on track.",https://chancellor.ucr.edu/sites/default/files/2021-04/CHASSmemo_Campus%2520safety_21.04.02.pdf
Events,"EAOP at UC Riverside hosts a number of events for program participants throughout the year. Connect with EAOP to learn about the conferences, test prep workshops, college tours and other events hosted during the current academic year.",https://eaop.ucr.edu/events
Return to Campus,Return to Campus protocols  ,https://ehs.ucr.edu/coronavirus/return
Our Schools,EAOP at UC Riverside serves students who attend 20 local high schools or are affiliated with one of its community partners. Connect with EAOP to learn more about the students it serves and the community organizations it partners with to fulfill its mission of preparing economically and/or educationally disadvantaged high school students for college.,https://eaop.ucr.edu/our-schools
Return to campus planning,"Dear Campus Community,",https://insideucr.ucr.edu/announcements/2021/05/03/return-campus-planning
Operational Continuity,"Charge Guide preparation of the workplace for return of employees, including appropriate physical distancing and other protective measures designed to limit community spread. Evaluate on-campus housing scenarios in consultation with Public Health working group. Members Gerry Bomotti, Lead Sheila Hedayati, Co-Lead Tammy Few, Co-Lead Jason Espinoza, Project Manager Monty Anderson Sean Carson Erika De Leon ",https://campusreturn.ucr.edu/operations-support-recovery
Help and Resources,Guide to Working from Home,https://keepworking.ucr.edu/helpandresources
TRAINING TOOLKIT,"Explore our suite of IT training resources, including video tutorials, job aids, and reference guides.",https://its.ucr.edu/training
CUCSA | Council of University of California Staff Assemblies,Council of University of California Staff Assemblies…,https://cucsa.ucla.edu/
Security and Access,   ,https://keepworking.ucr.edu/securityandaccess
Student Advising,EAOP at UC Riverside provides participants with a range of resources and support during advising sessions. Connect with EAOP to learn more about advising and how students can prepare for these sessions.,https://eaop.ucr.edu/resources/advising
Information Technology Solutions,Making IT Possible,https://its.ucr.edu/ITS_Resources
BE CYBERSMART,Be Cybersmart: Learn how to protect yourself and the UC Riverside community from cybersecurity scams and threats.,https://its.ucr.edu/cybersmart
Information Technology Solutions,Making IT Possible,https://its.ucr.edu/phishingtips
Lactation Accommodation Program,"In an effort to promote a family-friendly work environment for breastfeeding mothers, UC Riverside has expanded lactation room locations. Effective immediately, faculty, staff and students will have access to eight (8) lactation rooms and alternate options to ensure nursing mothers have access to a private space for lactation purposes.",https://hr.ucr.edu/employee-resources/lactation-accommodation-program
Information Technology Solutions,Making IT Possible,https://its.ucr.edu/ITS_Intro
Human Resources,Helping employees maximize their potential,https://hr.ucr.edu/document/local-procedure-2210-leave-absence
Popular Topics,"Popular Topics, Practical Information College can be tough.",https://counseling.ucr.edu/popular-topics
What to do if you Suspect Email Phishing at UCR,"Phishing emails are crafted to look legitimate but contain malicious programming or content used to capture sensitive data, which can put you and your workplace at risk. Here's how to protect yourself and UCR.",https://its.ucr.edu/what-to-do-if-you-suspect-email-phishing-at-ucr
Phishing email simulations,"With email being a mainstay of communication at UCR, malicious actors often utilize it in an attempt to steal personal or private information. Phishing (pronounced ‘fishing’) is one of the most common attack methods used by cybercriminals today.",https://insideucr.ucr.edu/announcements/2020/02/12/phishing-email-simulations
 - HighlanderLink,"Discover unique opportunities at HighlanderLink! Find and attend events, browse and join organizations, and showcase your involvement.",https://highlanderlink.ucr.edu/organization/nami
Human Resources,Helping employees maximize their potential,https://hr.ucr.edu/
ITS advisory on protecting against hackers,Dear Campus Community:,https://insideucr.ucr.edu/announcements/2020/05/18/its-advisory-protecting-against-hackers
Welcome Transfer Students!,"UCR offers a range of specialized programming and resources designed to help transfer students transition to life on campus and to succeed on their degree journeys. Connect with Student Life to learn more about offerings for transfer students, including mentorships and student organizations.",https://studentlife.ucr.edu/welcome-transfer-students
404 - Content Not Found,"We're Sorry, The requested object or URL could not be found. The link you followed is either outdated, inaccurate, or has been removed. Please visit the homepage to get back on track.",https://casemanagement.ucr.edu/%2520%2520
Active Minds,"  The Well's Active Minds  Active Minds is a student led, nationally recognized organization with over 400 campus chapte",https://well.ucr.edu/get-involved/active-minds
UCR Profiles - Search & Browse,Search & Browse UCR Faculty & Staff,https://profiles.ucr.edu/app/home/
Health Care & Services,"Student Health Services (SHS) provides UCR with a range of health care services, including medical and dental appointments, lab work, and vaccinations. Connect with SHS to learn more about the services available to you and how to make an appointment with one of our providers.",https://studenthealth.ucr.edu/health-services
UC Immigrant Legal Services Center,"UCR Immigration Attorney: Alfonso Maldonado Silva Alfonso graduated from UCR in 2013 with a Bachelor’s Degree in Philosophy Law and Society and graduated from Western State College of Law in 2017. During law school, Alfonso successfully argued before the United States Court of Appeals for the Ninth Circuit in 2017. He then went on to represent asylum seekers, including unaccompanied minors, in removal proceedings.",https://usp.ucr.edu/UCILSC
Transfer Success Program,"  is a support program for incoming and matriculated transfer students. In collaboration with campus wide partners, the program connects students to student success services to empower students in their academic, professional, and personal endeavors while assisting students in navigating the university system.",https://arc.ucr.edu/tsp
T-Camp,"T-Camp is an intercampus retreat for transgender, nonbinary, & gender questioning students. The UC Riverside LGBT Resource Center will cover the cost of SoCal T-Camp for Highlanders who are accepted to attend. Apply for T-Camp today!",https://out.ucr.edu/programs/tcamp
Tuesday Talks,"UCR LGBTRC hosts Tuesday Talks, which covers topics that are important to LGBTQ Highlanders and their allies. All are welcome to join, so please log in for the next session!",https://out.ucr.edu/programs/tuesday-talks
Transportation Services,Moving You Forward,https://transportation.ucr.edu/document/uc-riverside-traffic-parking-and-other-codes
Gender-Inclusive Housing,UCR’s gender-inclusive housing options affirm the diversity and complexity of student gender identities and relationships by providing an opportunity to consenting students for roommate pairings and room assignments without regard to a student’s sex or gender identity.,https://housing.ucr.edu/gender-inclusive-housing
Compliance,Integrity and Accountability,https://compliance.ucr.edu/document/anti-discrimination-policy-systemwide-review-draft
Compliance,Integrity and Accountability,https://compliance.ucr.edu/document/anti-discrimination-systemwide-review-cover-letter
UCR Trans Guide,"LGBT Resource Center's Trans Guide will help you learn more about campus resources, supportive programs, and special events connected to gender identity and expression at UCR. Get the Trans Guide today!",https://out.ucr.edu/resources/ucr-trans-guide
404 - Content Not Found,"We're Sorry, The requested object or URL could not be found. The link you followed is either outdated, inaccurate, or has been removed. Please visit the homepage to get back on track.",https://counseling.ucr.edu/%2520https%3A/counseling.ucr.edu/responding-distressed-students
UCR Profiles - Search & Browse,Search & Browse UCR Faculty & Staff,https://profiles.ucr.edu/app/home/profile/nancyt
Task Force on Gender Recognition and Lived Name,Task Force on Gender Recognition and Lived Name   Presidential Policy on Gender Recognition & Lived Name President Drake released this policy in November 2020. Policy Overview and UCR Action Items UC Riverside Information Technology Solutions is currently working on an implementation strategy and timeline (see links to the right).,https://chancellor.ucr.edu/gender-recognition-and-lived-name-committee
2022 WSCUC Special Visit,"2022 WSCUC Special Visit  As a follow-up to the 2018 Accreditation Process, UCR completed its WSCUC Special Visit in February 2022. The Special Visit was a chance for UCR to address the issues identified in the 2018 Action Letter. UCR obtained full reaffirmation until the next full visit in fall 2026. Click the tabs to the left to access documents related to the 2022 Accreditation Visit.",https://wasc.ucr.edu/2022-wscuc-special-visit
Events,"Join the LGBT Resource Center at any of our year-round events that aim to bring together the LGBTQ and allies community. Meet friends, share stories, and learn about resources. Join our next event!",https://out.ucr.edu/events
Educational Trainings,   ,https://out.ucr.edu/educational-trainings
404 - Content Not Found,"We're Sorry, The requested object or URL could not be found. The link you followed is either outdated, inaccurate, or has been removed. Please visit the homepage to get back on track.",https://chancellor.ucr.edu/sites/default/files/2021-06/ITS%2BImplementation%2Bof%2BCA%2BGender%2BAct%2BProject.pdf
2018 Accreditation Process,"How UCR's self-study was created In December of 2016 there was a “kickoff” meeting to brief key leaders from the academic senate, the deans’ offices and other faculty and administrators about the reaffirmation of accreditation process. Following that, the Vice Provost for Undergraduate Education (and campus Accreditation Liaison Officer) convened an accreditation workgroup to begin assembling a draft of the institutional report. This has already involved meetings and discussions with individuals from across campus and will continue to do so.",https://wasc.ucr.edu/2018-accreditation-process
Supervisor Guidance – New Hires During Campus Closure, ,https://hr.ucr.edu/front/coronavirus-covid-19-hr-information-and-resources/supervisor-guidance-new-hires-during-campus-closure
Human Resources Management System,"Human Resources Management System The Human Resources Management System (HRMS) is a collaboration between Human Resources, Information Technology Solutions (ITS) and our HR system users as part of an ongoing effort to provide the campus with updated HR technology. The objectives of the HRMS include:",https://hr.ucr.edu/front/human-resources-tools/human-resources-management-system
Human Resources,Helping employees maximize their potential,https://hr.ucr.edu/document/uc-ppsm-30-compensation
Human Resources,Helping employees maximize their potential,https://hr.ucr.edu/document/employee-labor-relations-union-contracts-and-representative-contacts
Updates,"FAQs for Implementation of New Labor Contracts for GSRs, ASEs and Postdocs",https://graduate.ucr.edu/updates
Human Resources,Helping employees maximize their potential,https://hr.ucr.edu/document/ucr-star-plan-guidelines-2022-23
Harvest Shared Services Center,Harvest Prime,https://harvestprime.ucr.edu/
404 - Content Not Found,"We're Sorry, The requested object or URL could not be found. The link you followed is either outdated, inaccurate, or has been removed. Please visit the homepage to get back on track.",https://campusmap.ucr.edu/directions.php
404,"404 Not Found We've updated on online presence!  Sorry the page you're looking for is no longer here. Please use the menu above to find what you're looking for, or maybe it's one of these popular destinations:  Admissions Graduate Programs",https://graduate.ucr.edu/patrick.napier%40ucr.edu
404 - Content Not Found,"We're Sorry, The requested object or URL could not be found. The link you followed is either outdated, inaccurate, or has been removed. Please visit the homepage to get back on track.",https://careers.ucr.edu/resources/job-search-strategies/careernetwork.ucr.edu
 - HighlanderLink,"Discover unique opportunities at HighlanderLink! Find and attend events, browse and join organizations, and showcase your involvement.",https://highlanderlink.ucr.edu/
UC Management Skills Assessment Program,Investing Today in the Leaders of Tomorrow,https://msap.ucr.edu/
'Hats' off to UCR alumnus,"In 2016, Christopher Watkins III created Hats",https://chass.ucr.edu/press/2020/04/30/hats-ucr-alumnus
UCR Profiles - Search & Browse,Search & Browse UCR Faculty & Staff,https://profiles.ucr.edu/app/home/profile/saritas
California Digital Newspaper Collection,California Digital Newspaper Collection,https://cdnc.ucr.edu/cgi-bin/cdnc
Facility Maintenance and Projects,Assist with coordination of scheduled maintenance,https://docs.google.com/forms/d/e/1FAIpQLSdjP048treHgiHDy-NAUKGw3YsjhfsNulKwkkBbiSBo66pMyw/viewform?usp=send_form&usp=embed_facebook
Fellowships,"Center for Ideas & Society Resident Fellows 
2022-23  

History
Mellon Second Book Fellowship

Elephantasmagoria: Elephants in British and American Imperialism

Abstract
- 

History of Art
Mellon Second Book Fellowship

Inventing the Americas: Art, Archaeology, and the Modern Making of a Pre-Columbian",https://ideasandsociety.ucr.edu/fellowships/
 - HighlanderLink,"Discover unique opportunities at HighlanderLink! Find and attend events, browse and join organizations, and showcase your involvement.",https://highlanderlink.ucr.edu/organization/pisaatucr
UCR Profiles - Search & Browse,Search & Browse UCR Faculty & Staff,https://profiles.ucr.edu/app/home/profile/eschwitz
404 - Content Not Found,"We're Sorry, The requested object or URL could not be found. The link you followed is either outdated, inaccurate, or has been removed. Please visit the homepage to get back on track.",https://music.ucr.edu/ensembles/rondalla/
404 - Content Not Found,"We're Sorry, The requested object or URL could not be found. The link you followed is either outdated, inaccurate, or has been removed. Please visit the homepage to get back on track.",https://music.ucr.edu/ensembles/mariachi-mexicatlballet-folklorico-mexicatl/
404 - Content Not Found,"We're Sorry, The requested object or URL could not be found. The link you followed is either outdated, inaccurate, or has been removed. Please visit the homepage to get back on track.",https://music.ucr.edu/ensembles/mayupatapi/
Mellon Foundation awards $2.9 million for ‘Latinx Futures’,"The grant will support programs within UCR’s new Latino and Latin American Studies Research Center, set to launch February 2021.",https://news.ucr.edu/articles/2021/01/13/mellon-foundation-awards-29-million-latinx-futures
UCR Profiles - Search & Browse,Search & Browse UCR Faculty & Staff,https://profiles.ucr.edu/app/home/profile/alfonsog
404 - Content Not Found,"We're Sorry, The requested object or URL could not be found. The link you followed is either outdated, inaccurate, or has been removed. Please visit the homepage to get back on track.",https://hispanicstudies.ucr.edu/people/faculty/claudia-holguin-mendoza/
Florence Bayz Music Series,2022-2023 Florence Bayz Music Series,https://music.ucr.edu/florence-bayz-music-series
  Events," on February 1, 2023",https://events.ucr.edu/calendar/day/2023/2/1
404 - Content Not Found,"We're Sorry, The requested object or URL could not be found. The link you followed is either outdated, inaccurate, or has been removed. Please visit the homepage to get back on track.",https://campusmap.ucr.edu/campusMap.php
Boozing while breastfeeding impacts health of newborns,"Studies have shown that consuming alcohol during pregnancy can alter the brain and behavioral development of gestating offspring. Currently, the Centers for Disease Control and Prevention advises against maternal alcohol consumption during pregnancy and state that there is no known safe level of consumption. What are the consequences, however, of mothers consuming alcohol while breastfeeding? A research team at the University of California, Riverside, performed a mouse study to find out.",https://news.ucr.edu/articles/2023/04/19/boozing-while-breastfeeding-impacts-health-newborns
