Ancestor of all animals identified in Australian fossils,A wormlike creature that lived more than 555 million years ago is the earliest bilaterian,https://news.ucr.edu/articles/2020/03/23/ancestor-all-animals-identified-australian-fossils
Newly discovered planet zips around baby star in a week,The discovery gives scientists a front seat to the earliest stages of planet formation,https://news.ucr.edu/articles/2020/06/24/newly-discovered-planet-zips-around-baby-star-week
Ancient meteorite site on Earth could reveal new clues about Mars’ past,UC Riverside scientists have devised new analytical tools to break down the enigmatic history of Mars’ atmosphere — and whether life was once possible there.,https://news.ucr.edu/articles/2020/02/26/ancient-meteorite-site-earth-could-reveal-new-clues-about-mars-past
Experiments in growing algae without sunlight,"Elizabeth Hann, a doctoral student in plant biology at UC Riverside, is using a two-year, $60,000 fellowship from the Link Foundation to test whether she can grow algae for biofuels completely in the dark using solar-generated electricity. ",https://news.ucr.edu/articles/2020/09/15/experiments-growing-algae-without-sunlight
Student services – virtual style,UCR welcomes students with an assortment of digital programming and support services.,https://news.ucr.edu/articles/2020/10/02/student-services-virtual-style
How well do you know the Salton Sea?,  What was once a destination for Hollywood's biggest stars is now one of California's gravest environmental threats. Test your knowledge to see how much you know about the Salton Sea.      ,https://news.ucr.edu/articles/2019/05/02/how-well-do-you-know-salton-sea
Salton Sea restoration efforts could fail without science,"There are finally efforts under way to improve the environmental health disaster that is the Salton Sea — California’s largest and most polluted lake. However, a group of UC Riverside scientists, engineers, medical experts, and economists has published a new report warning that without science, these efforts may not succeed.",https://news.ucr.edu/articles/2021/08/12/salton-sea-restoration-efforts-could-fail-without-science
Study confirms link between spatial and math skills,Improving students’ spatial skills could improve math skills as well,https://news.ucr.edu/articles/2021/11/30/study-confirms-link-between-spatial-and-math-skills
Chance meeting spawned a tech startup for these engineering students,Friends Mahmood Shaheen and Nathaniel Ortiz are taking recycling to the next level,https://news.ucr.edu/articles/2021/06/25/chance-meeting-spawned-tech-startup-these-engineering-students
Campus community gets first look at OASIS,"On a campus already actively growing its footprint in Inland Southern California, a proposed clean technology park would lead to a reinvention of UC Riverside’s relationship with the city and region. The park is Phase I of a more ambitious research and economic development project. ",https://news.ucr.edu/articles/2021/06/16/campus-community-gets-first-look-oasis
Symposium celebrates 50 Years of clean air leadership,CARB’s 50th Anniversary Technology Symposium and Showcase highlighted CARB’s history driving innovative technologies that have made monumental improvements to California’s air quality,https://news.ucr.edu/articles/2018/06/07/symposium-celebrates-50-years-clean-air-leadership
Why the NBA is seeking technology built by UCR students and alumni,"EDGE Sound Research, co-founded by a student and an alum, was one of seven companies from around the world selected for the NBA Launchpad program.",https://news.ucr.edu/articles/2023/03/21/why-nba-seeking-technology-built-ucr-students-and-alumni
Space travel can make the gut leaky,UC Riverside-led study tested the effects of microgravity on intestinal epithelial cells,https://news.ucr.edu/articles/2019/11/26/space-travel-can-make-gut-leaky
Omega centauri unlikely to harbor life,Close encounters between stars in the Milky Way’s largest globular cluster leave little room for habitable planetary systems,https://news.ucr.edu/articles/2018/08/09/omega-centauri-unlikely-harbor-life
Search for life beyond the solar system topic of faculty research lecture,Timothy Lyons will deliver the 66th annual lecture at UC Riverside,https://news.ucr.edu/articles/2018/05/16/search-life-beyond-solar-system-topic-faculty-research-lecture
Scientists honored by American Geophysical Union,Marilyn Fogel and Timothy Lyons will be honored as new fellows during December meeting,https://news.ucr.edu/articles/2018/08/09/scientists-honored-american-geophysical-union
Special journal issue looks for new clues about old life,Collection edited by UCR researchers focuses on the role of rising oxygen in the birth of complex life,https://news.ucr.edu/articles/2018/10/22/special-journal-issue-looks-new-clues-about-old-life
Drug decreases gut leakiness associated with ulcerative colitis,UC Riverside-led study is the first to show how tofacitinib affects epithelial cells lining the gut,https://news.ucr.edu/articles/2019/12/04/drug-decreases-gut-leakiness-associated-ulcerative-colitis
Power play: Manipulation and absurdity in photography,California Museum of Photography exhibition explores how artist Robert Cumming exposed the truth and trickery of photography,https://news.ucr.edu/articles/2019/10/02/power-play-manipulation-and-absurdity-photography
Dual exhibitions from photographer John Divola examine social identity and the sublime,“STRATUM” and “Clive Wearing’s Dilemma” are on view at the California Museum of Photography May 11-Sept. 8,https://news.ucr.edu/articles/2019/05/17/dual-exhibitions-photographer-john-divola-examine-social-identity-and-sublime
UC Riverside students take first and second place at prestigious conference,Leadership-in-action competition yields prizewinning strategies for increasing Hispanic leadership in engineering,https://news.ucr.edu/articles/2018/09/25/uc-riverside-students-take-first-and-second-place-prestigious-conference
Athletics Set to Induct 2018 Hall of Fame Class,"RIVERSIDE, Calif. – The UC Riverside Athletics Department is pleased to announce its 2018 Athletics Hall of Fame inductees. Scheduled to receive the highest honors during the induction ceremony on Nov. 16 at the Historic Mission Inn Hotel & Spa in downtown Riverside are Larry Cunningham (men's basketball), David Finley (baseball), Fred Morawczski (football), Melissa Sanchez (softball), and the 1982 baseball team.",https://news.ucr.edu/articles/2018/09/25/athletics-set-induct-2018-hall-fame-class-0
UC Riverside researchers find potent chemical agents that can thwart cancer metastasis,Novel agents 135H11 and 135H12 move research closer to drug development,https://news.ucr.edu/articles/2018/09/25/uc-riverside-researchers-find-potent-chemical-agents-can-thwart-cancer
Fallout 'serious' for noncompliance to UC vaccination policy,"As the Aug. 16 deadline looms for compliance with the UC vaccination policy, the fallout for those who fail to comply is being made clear.  In a campus announcement this week, Human Resources delineated protocols for employees who haven’t provided proof of full vaccination or requested an exemption or deferral by Aug. 16.",https://news.ucr.edu/articles/2021/08/12/fallout-serious-noncompliance-uc-vaccination-policy
Two new creatures discovered from dawn of animal life,Names of recently discovered Ediacaran era fossil animals honor President Barack Obama and Sir David Attenborough,https://news.ucr.edu/articles/2018/06/18/two-new-creatures-discovered-dawn-animal-life
New NASA research consortium to tackle life's origins,NASA is uniting experts across multiple disciplines to investigate life's beginnings on our planet -- and to explore if and how life sprung up elsewhere in the universe,https://news.ucr.edu/articles/2019/02/14/new-nasa-research-consortium-tackle-lifes-origins
Study: Children as young as 7 suffer effects of discrimination,"A new UC Riverside study finds children are sensitive to and suffer the impacts of discrimination as young as 7 years old. Previous studies have shown children can identify racism at that age, but the study from Tuppett Yates, a UC Riverside psychology professor, and Ana Marcelo, an assistant professor of psychology at Clark University, is the first to study the impacts on children under 10 years old. The study also suggests that a strong sense of ethnic-racial identity is a significant buffer against these negative effects.",https://news.ucr.edu/articles/2018/10/22/study-children-young-7-suffer-effects-discrimination
Drug found to correct gene defect that causes immune-driven gut leakiness,UC Riverside-led study is the first to show how tofacitinib rescues gut barrier function from overactive immune cells,https://news.ucr.edu/articles/2020/09/29/drug-found-correct-gene-defect-causes-immune-driven-gut-leakiness
UC Riverside Fall 2018 admissions show surge in transfer student numbers,"In two years, UCR transfer applications have climbed by 23 percent.",https://news.ucr.edu/articles/2018/07/11/uc-riverside-fall-2018-admissions-show-surge-transfer-student-numbers
Researchers use a molecular trojan horse to deliver chemotherapeutic drug to cancer cells,A UCR research team has discovered a way for chemotherapy drug paclitaxel to target migrating cancer cells,https://news.ucr.edu/articles/2018/02/23/researchers-use-molecular-trojan-horse-deliver-chemotherapeutic-drug-cancer-0
How UCR Library’s contact-free curbside delivery works,"Students, faculty, and staff can still access books and materials.",https://news.ucr.edu/articles/2020/12/09/how-ucr-librarys-contact-free-curbside-delivery-works
Want to save shelter animals? Fight for social justice,"Humane communities would endorse animal-friendly affordable housing, living wages, and recognize the importance of human-animal bonds",https://news.ucr.edu/articles/2020/08/26/want-save-shelter-animals-fight-social-justice
Queer lessons for straight couples,Book shows how heterosexuals can learn from LGBT people to have better relationships,https://news.ucr.edu/articles/2020/09/21/queer-lessons-straight-couples
If dogs could talk,New research suggests our relationships with pit bulls shed light on the ways we reproduce social inequality,https://news.ucr.edu/articles/2019/11/25/if-dogs-could-talk
UCR graduate students share why their research matters,26 Ph.D. and master’s students visited with state lawmakers to give them firsthand insight into their work and why it merits more state investment,https://news.ucr.edu/articles/2018/03/26/ucr-graduate-students-share-why-their-research-matters
Teaching the teachers,Weeklong Summer Physics Teacher Academy at UC Riverside serves a large region in Southern California,https://news.ucr.edu/articles/2018/06/25/teaching-teachers
Acclaimed industry designer Scott Saltsman presents summer youth workshop in video game design,Gear-up for a future in technology at UCR Extension and UCR Palm Desert,https://news.ucr.edu/articles/2018/06/25/acclaimed-industry-designer-scott-saltsman-presents-summer-youth-workshop-video
Why are plants green?,UC Riverside-led research team’s model to explain photosynthesis lays out the next challenging phase of research on how green plants transform light energy into chemical energy,https://news.ucr.edu/articles/2020/06/25/why-are-plants-green
How the coronavirus could be prevented from invading a host cell,UC Riverside-led study shows inhibiting two host cell proteases can accomplish the task,https://news.ucr.edu/articles/2020/05/29/how-coronavirus-could-be-prevented-invading-host-cell
Graduate student’s BADASS code has astronomical benefits,"Open-source code developed at UC Riverside is free, versatile, and easy to use",https://news.ucr.edu/articles/2020/12/16/graduate-students-badass-code-has-astronomical-benefits
Astronomers offer possible explanation for elusive dark-matter-free galaxies,UC Riverside-led study finds extreme tidal mass loss in dwarf galaxies formed in a simulation,https://news.ucr.edu/articles/2021/02/09/astronomers-offer-possible-explanation-elusive-dark-matter-free-galaxies
Moiré patterns facilitate discovery of novel insulating phases,UC Riverside-led study observed unexpected insulating phases by placing electrons on stacked monolayers of 2D semiconductors,https://news.ucr.edu/articles/2021/02/15/moire-patterns-facilitate-discovery-novel-insulating-phases
Searching for elusive supersymmetric particles,UC Riverside physicist on a team that conducted experiments at the Large Hadron Collider,https://news.ucr.edu/articles/2021/03/10/searching-elusive-supersymmetric-particles
How a supermassive black hole originates,UC Riverside-led study points to a seed black hole produced by a dark matter halo collapse,https://news.ucr.edu/articles/2021/06/16/how-supermassive-black-hole-originates
Researchers use a nanoscale synthetic antiferromagnet to toggle nonlinear spin dynamics,UC Riverside-led work could lead to better computer technologies,https://news.ucr.edu/articles/2021/04/28/researchers-use-nanoscale-synthetic-antiferromagnet-toggle-nonlinear-spin
Astronomers explain origin of elusive ultradiffuse galaxies,UC Riverside astronomer and colleagues use simulations to reveal how the very faint dwarf galaxies are born,https://news.ucr.edu/articles/2021/09/06/astronomers-explain-origin-elusive-ultradiffuse-galaxies
A new dimension in the quest to understand dark matter,UC Riverside dark matter research program targets assumptions about particle physics,https://news.ucr.edu/articles/2021/06/02/new-dimension-quest-understand-dark-matter
Using physics to explain the transmission effects of different SARS-CoV-2 mutations,UC Riverside-led team develops new computational method that applies techniques from statistical physics mathematical models in epidemiology,https://news.ucr.edu/articles/2022/02/04/using-physics-explain-transmission-effects-different-sars-cov-2-mutations
Rise of oxygen on Earth: Initial estimates off by 100 million years,"New research shows the permanent rise of oxygen in our atmosphere, which set the stage for life as we know it, happened 100 million years later than previously thought. A team including UC Riverside found that oxygen fluctuated dramatically after its early appearance before becoming a permanent constituent of the atmosphere.",https://news.ucr.edu/articles/2021/04/05/rise-oxygen-earth-initial-estimates-100-million-years
Glass nanopore pulls DNA like spaghetti through a needle,The purely electrical technique captures cell-free DNA from the surface of a sample,https://news.ucr.edu/articles/2021/04/05/glass-nanopore-pulls-dna-spaghetti-through-needle
"Family is our focus during pandemic, study finds","More fully appreciating family and engaging in more conflict are among the heightened experiences during the coronavirus pandemic, according to a new UC Riverside study. The study from David Funder’s psychology lab looked at how people experience everyday life and its situations and how those experiences change because of an extraordinary event – the global pandemic.",https://news.ucr.edu/articles/2021/01/29/family-our-focus-during-pandemic-study-finds
UCR 'EARS' students won't let pandemic stop the music,"To a voyeur at this May 1 virtual songwriting session, it was straight-up fun; a valve release for pent-up pandemic creativity. But the undercurrent of the music production session among members of the UCR EARS music group was something more intentional. Once upon a musical ambition, hitting it big meant flagging the gaze of one of Berry Gordy’s or David Geffen’s minions in some smoky joint, or summoning the help of a DJ willing to give an unknown B-sider a spin on the turntable.",https://news.ucr.edu/articles/2020/05/27/ucr-ears-students-wont-let-pandemic-stop-music
NIH grant to physicist focuses on how pathogens evolve,Research could lead to the design of new and better treatments to fight disease,https://news.ucr.edu/articles/2020/08/10/nih-grant-physicist-focuses-how-pathogens-evolve
Chemical ‘nose’ sniffs critical differences in DNA structures,"Small changes in the structure of DNA have been implicated in breast cancer and other diseases, but they’ve been extremely difficult to detect — until now. Using what they describe as a “chemical nose,” UC Riverside chemists are able to “smell” when bits of DNA are folded in unusual ways.",https://news.ucr.edu/articles/2021/05/04/chemical-nose-sniffs-critical-differences-dna-structures
Experts on brain-eating amoeba,"  For fast access to experts, email news@ucr.edu  Haizhou Liu, associate professor of chemical and environmental engineering. Professor Liu works to discover new and improved methods of removing impurities from drinking water and ensuring the safety of our water supply. Liu can speak to the difference between chloramine and chlorine, and water treatment chemistry in general. haizhou@engr.ucr.edu ",https://news.ucr.edu/articles/2020/09/29/experts-brain-eating-amoeba
Unraveling a mystery surrounding cosmic matter,"UC Riverside physicist and colleague invoke the cosmological collider to explain why matter, and not antimatter, dominates the universe",https://news.ucr.edu/articles/2022/09/08/unraveling-mystery-surrounding-cosmic-matter
Surprisingly high fraction of dead galaxies found in ancient galactic city,"Why cluster’s galaxies are unlike those in all the other known protoclusters is a mystery, says UC Riverside-led team",https://news.ucr.edu/articles/2022/02/09/surprisingly-high-fraction-dead-galaxies-found-ancient-galactic-city
Report paints portrait of Inland Empire’s growing workforce,"The region’s job growth exceeds the statewide average, and efforts are underway to ensure more good jobs that allow families to make ends meet",https://news.ucr.edu/articles/2018/12/03/report-paints-portrait-inland-empires-growing-workforce
Why are dark matter halos of ultra-diffuse galaxies so … odd?,A UC Riverside physicist explains,https://news.ucr.edu/articles/2022/09/12/why-are-dark-matter-halos-ultra-diffuse-galaxies-so-odd
Committee for accurate Inland Empire census count marks formal launch,"When it comes to the 2020 census, every person counts; here’s why",https://news.ucr.edu/articles/2019/04/18/committee-accurate-inland-empire-census-count-marks-formal-launch
Center for Social Innovation launches regional platform for public discourse,The SoCal Policy Forum platform is a collaboration between UCR and Southern California News Group,https://news.ucr.edu/articles/2019/08/01/center-social-innovation-launches-regional-platform-public-discourse
Want to see California on the rise? Look inland,A new coalition headed by a UCR professor wants to change the way you think about the regions beyond California’s coast,https://news.ucr.edu/articles/2019/06/24/want-see-california-rise-look-inland
Who is and who’s not receiving pandemic-related unemployment aid in Riverside County,Non-Hispanic whites least likely to fall outside of unemployment insurance coverage,https://news.ucr.edu/articles/2020/06/25/who-and-whos-not-receiving-pandemic-related-unemployment-aid-riverside-county
Commuters are inhaling unacceptably high levels of carcinogens,"New UC Riverside research shows the average commuter in California is breathing unsustainably high levels of benzene and formaldehyde, two Prop. 65-listed, carcinogenic chemicals.",https://news.ucr.edu/articles/2021/02/15/commuters-are-inhaling-unacceptably-high-levels-carcinogens
Here’s how UC Riverside is preparing for the 2020 census,"UCR staffers, students are ramping up efforts to ensure a complete count in the Inland Empire and beyond",https://news.ucr.edu/articles/2019/10/28/heres-how-uc-riverside-preparing-2020-census
Report provides introduction to Inland Empire’s women,“State of Women in the Inland Empire” is the result of collaboration between UC Riverside’s Center for Social Innovation and Women’s Resource Center,https://news.ucr.edu/articles/2019/11/04/report-provides-introduction-inland-empires-women
"IE students disciplined disproportionately, study finds","A report from the UC Riverside Center for Social Innovation finds disproportionately high discipline for Black and Native American students in Inland Empire schools. “These racial disparities persist, even though there have been some notable reductions in overall suspension rates due to changes in state policy and local practices,” reads the report, “State of Education Equity in the Inland Empire.”",https://news.ucr.edu/articles/2020/10/12/ie-students-disciplined-disproportionately-study-finds
AAPI Data releases mapping tool for Asian Americans and Pacific Islanders,"Ahead of census, UCR-based research initiative offers resource to better understand fastest-growing racial groups in U.S.",https://news.ucr.edu/articles/2020/01/31/aapi-data-releases-mapping-tool-asian-americans-and-pacific-islanders
Census Legacies looks to perpetuate Census success,"This week, more than 200 leaders from across the United States helped launch Census Legacies, a new community-building effort by the Center for Social Innovation at UC Riverside with partners in philanthropy, government, and community. The initiative aims to build more inclusive and equitable regions, using the same messengers and coalitions that helped ensure strong community participation in the 2020 Census.",https://news.ucr.edu/articles/2020/12/18/census-legacies-looks-perpetuate-census-success
Center for Social Innovation tapped for equity project,"The Southern California Association of Governments, or SCAG, the nation’s largest metropolitan planning organization representing six counties, 191 cities, and more than 18 million residents, has chosen the Center for Social Innovation at UC Riverside to conduct research and offer insights and recommendations to advance economic inclusion and equity across Southern California.",https://news.ucr.edu/articles/2021/03/10/center-social-innovation-tapped-equity-project
Latino census data points to college-graduation disparity,"Sept. 25, the Center for Social Innovation released a report based on census data that asserts only 11% of Latinos in the Inland Empire have a bachelor’s degree or higher, compared with 35% overall in California and 33% nationally. Latinos comprise 51 percent of the 4.65 million people who live in the Inland Empire. ",https://news.ucr.edu/articles/2022/09/26/latino-census-data-points-college-graduation-disparity
UCR campus set to reopen in fall 2021,"On Jan. 11, UC President Michael V. Drake announced a fall 2021 systemwide return to in-person instruction.",https://news.ucr.edu/articles/2021/01/13/ucr-campus-set-reopen-fall-2021
Scientists crack structure of a novel enzyme linked to cell growth and cancer,UC Riverside-led study could lead to the development of drugs that target liver and other cancers,https://news.ucr.edu/articles/2019/11/06/scientists-crack-structure-novel-enzyme-linked-cell-growth-and-cancer
Dance with your soul at UC Riverside’s ‘NOT FESTIVAL’,"NOT FESTIVAL comes to Southern California, led by UCR’s Luis Lara Malvacías",https://news.ucr.edu/articles/2018/02/12/dance-your-soul-uc-riversides-not-festival
Media's framing of disease may lead to AAPI discrimination,"Describing diseases as originating from animals foreign to the Western diet serves to boost stereotypes of Asian culture and increase discrimination, according to new research from UC Riverside, Texas Tech, and Texas A&M.",https://news.ucr.edu/articles/2021/07/13/medias-framing-disease-may-lead-aapi-discrimination
First-year students: Making ‘the best out of this situation’,Resident advisors are creating ways to remain virtually connected while building a sense of community with first-year students in campus housing.,https://news.ucr.edu/articles/2020/12/18/first-year-students-making-best-out-situation
Experts on DACA,"On Dec. 4, a federal judge restored the rights afforded undocumented immigrants eligible for the Obama-era Deferred Action for Childhood Arrivals, or DACA program. The program had been in a state of suspension throughout the Trump presidency.",https://news.ucr.edu/articles/2020/12/04/experts-daca
UC systemwide survey reveals disparities among undocumented students,"Findings include greater instances of depression, financial instability, and lower grade point averages.",https://news.ucr.edu/articles/2021/03/01/uc-systemwide-survey-reveals-disparities-among-undocumented-students
Grains in the rain,"Of the major food crops, only rice is currently able to survive flooding. Thanks to new research, that could soon change -- good news for a world in which rains are increasing in both frequency and intensity.",https://news.ucr.edu/articles/2019/09/18/grains-rain
Grad students battle for best pitch,"UC Riverside's best and brightest will go head to head during annual Grad Slam finals event, held at the Culver Center",https://news.ucr.edu/articles/2018/04/11/grad-students-battle-best-pitch
‘You All Look Alike to Me’ is hard-wired in us,"You often hear it framed in a comic sense, though it’s a form of stereotyping, and even prejudice.  “You all look alike to me.”  To one race, the tired adage implies, people in other races are tough to differentiate from each other. Some call it the “other-race effect.” ",https://news.ucr.edu/articles/2019/07/04/you-all-look-alike-me-hard-wired-us
Magnetic teeth hold promise for materials and energy,A mollusk with teeth that can grind down rock may hold the key to making next generation abrasion-resistant materials and nanoscale materials for energy,https://news.ucr.edu/articles/2019/01/31/magnetic-teeth-hold-promise-materials-and-energy
